,rating,unique_id,Combination,Dry,Normal,Oily,Sensitive,Ageing,Blackheads,Blemishes,DarkCircles,Dryness,Dullness,FineLines&Wrinkles,Firmness&Elasticity,Oiliness,Pigmentation&DarkSpots,Puffiness,UnevenSkinTexture,UnevenSkinTone,VisiblePores,Balm,Cream,Gel,Liquid,Lotion,Oil,Spray,20s,30s,40s,50+,Under20
214,4.3,SULWHASOO-Concentrated Ginseng Renewing Cream EX,1,1,1,1,0,1,0,0,0,1,1,0,1,0,0,0,1,0,0,0,1,0,0,0,0,0,1,1,1,1,1
215,3.6,FRANK BODY-Everyday Face Moisturiser,0,0,1,1,0,0,1,0,0,1,1,0,0,1,0,0,0,0,0,0,1,0,0,0,0,0,1,1,1,1,1
216,4.3,CLE DE PEAU-Volumizing Cream Supreme,1,1,1,1,0,1,0,0,0,0,1,1,0,0,0,0,0,0,0,0,1,0,0,0,0,0,1,1,1,1,1
217,3.0,GIVENCHY-Ressource Rich Moisturizing Face Cream,1,1,1,1,1,0,0,0,0,1,1,0,0,0,0,0,0,0,0,0,1,0,0,0,0,0,1,1,1,1,1
218,4.5,MALIN + GOETZ-Advanced Renewal Moisturizer,1,1,1,1,1,0,0,0,0,1,0,1,0,0,0,0,1,0,0,0,1,0,0,0,0,0,1,1,1,1,1
219,4.3,SHISEIDO-Ultimune Future Power Shot (Limited Edition),1,1,1,1,0,0,0,0,0,1,0,0,0,0,0,0,0,0,0,0,1,0,0,0,0,0,1,1,1,1,1
220,3.6,THE INKEY LIST-Multi-Biotic Moisturiser,1,1,1,1,1,0,0,0,0,1,0,0,0,0,0,0,0,0,0,0,1,0,0,0,0,0,1,1,1,1,0
221,3.5,GIVENCHY-Skin Perfecto Compact Cream,1,1,1,1,0,0,0,0,0,1,1,0,0,0,0,0,1,0,0,0,1,0,0,0,0,0,1,1,1,1,1
222,5.0,CHARLOTTE TILBURY-Magic Cream Refill,1,1,1,1,0,0,0,0,0,1,1,1,0,0,0,0,0,0,0,0,1,0,0,0,0,0,1,1,1,1,1
223,4.3,CHARLOTTE TILBURY-Refillable Magic Cream,1,1,1,1,0,0,0,0,0,1,1,1,0,0,0,0,0,0,0,0,1,0,0,0,0,0,1,1,1,1,1
224,3.5,PIXI-Hydrating Milky Lotion,1,1,1,1,0,0,0,0,0,1,1,0,1,0,0,0,0,0,0,0,0,0,0,1,0,0,1,1,1,1,1
225,3.5,EVE LOM-Moisture Cream,1,1,1,1,1,0,0,0,0,1,1,1,0,0,0,0,1,1,0,0,1,0,0,0,0,0,1,1,1,1,1
226,4.1,PIXI-On-the-Glow Multi-Use Moisture Stick,1,1,1,1,1,0,0,0,0,1,1,0,1,0,0,0,0,0,0,0,0,0,0,1,0,0,1,1,1,1,1
227,3.8,DR. DENNIS GROSS-Hyaluronic Marine Moisture Cushion,1,1,1,1,0,0,0,0,0,0,1,0,1,0,0,0,1,0,0,0,1,1,0,0,0,0,1,1,1,1,1
228,4.5,KORA ORGANICS BY MIRANDA KERR-Turmeric Glow Moisturizer Refill Pod,1,1,1,1,1,1,0,0,0,0,1,1,0,0,1,0,1,0,0,0,1,0,0,0,0,0,1,1,1,1,0
229,4.0,KENZOKI-Nourishing Flow Hand & Nail Balm For Caress,1,1,1,1,0,0,0,0,0,1,0,0,0,0,0,0,1,0,0,0,1,0,0,0,0,0,1,1,1,1,1
230,4.2,WISHFUL-Honey Balm Jelly Moisturizer,1,1,1,1,1,0,0,0,0,1,1,0,0,1,1,0,1,1,1,1,0,1,0,0,0,0,1,1,1,1,0
231,3.7,INNISFREE-Jeju Orchid Enriched Cream,1,1,1,0,0,1,0,0,0,1,1,0,1,0,0,0,1,0,0,0,1,0,0,0,0,0,1,1,1,1,0
232,4.3,TALIKA-Eye Quintessence Day Cream + Night Serum Duo,1,1,1,1,0,1,0,0,0,1,0,1,1,0,0,0,1,0,0,0,1,0,1,0,0,0,1,1,1,1,1
233,4.3,LA MER-The Revitalized Transformation Collection (Christmas Limited Edition),1,1,1,1,0,0,0,0,0,1,1,0,0,0,0,0,1,0,0,0,1,0,1,0,0,0,1,1,1,1,1
234,4.3,LA MER-The Smoothing Moisture Duo Collection (Christmas Limited Edition),1,1,1,1,0,0,0,0,0,1,0,1,0,0,0,0,1,0,0,1,1,0,0,0,0,0,1,1,1,1,1
235,1.0,THREE-Balancing Cream R,1,1,1,1,0,0,0,0,0,1,1,0,0,0,0,0,0,0,0,0,1,0,0,0,0,0,1,1,1,1,1
236,4.3,CLE DE PEAU-Protective Fortifying Cream Refill,1,1,1,1,0,0,0,0,0,1,0,0,0,0,0,0,1,0,0,0,1,0,0,0,0,0,1,1,1,1,1
237,4.3,SHISEIDO-Men Total Revitalizer Cream,1,1,1,1,0,1,0,0,0,1,1,1,1,0,0,0,0,1,0,0,1,0,0,0,0,0,1,1,1,1,1
238,4.3,CLE DE PEAU-Protective Fortifying Cream Broad Spectrum SPF 22,1,1,1,1,0,0,0,0,0,1,0,0,0,0,0,0,1,0,0,0,1,0,0,0,0,0,1,1,1,1,1
239,5.0,WEI-Five Sacred Grains Rapid Glow Liquid Milk Moisturiser,1,1,1,1,1,0,0,0,0,1,1,0,0,0,0,0,1,1,0,0,0,0,1,1,0,0,1,1,1,1,1
240,5.0,LAB SERIES-Daily Rescue Hydrating Emulsion,1,1,1,1,0,0,0,0,0,1,1,0,0,0,0,0,0,0,0,0,0,0,0,1,0,0,1,1,1,1,1
241,4.3,SHISEIDO-Essential Energy Hydrating Day Cream Refill,1,1,1,1,1,0,0,0,0,1,1,0,0,0,0,0,1,0,0,0,1,0,0,0,0,0,1,1,1,1,1
242,4.4,MALIN + GOETZ-Vitamin E Face Moisturizer,1,1,1,1,1,0,0,0,0,1,0,0,0,0,0,0,0,0,0,0,1,0,0,0,0,0,1,1,1,1,1
243,4.4,BOBBI BROWN-Hydrating Water Fresh Cream Moisturiser,1,1,1,1,1,0,0,0,0,1,0,0,0,0,0,0,1,0,1,0,1,0,0,0,0,0,1,1,1,1,1
244,3.8,FOR BELOVED ONE-Advanced Hyaluronic Acid GHK-Cu Moisturizing Serum,1,1,1,1,1,0,0,0,0,1,0,0,0,0,0,0,0,0,0,0,0,0,0,1,0,0,1,1,1,1,0
245,4.3,SHISEIDO-Benefiance Wrinkle Smoothing Cream,1,1,1,1,0,1,0,0,0,0,1,1,1,0,0,0,0,0,0,0,1,0,0,0,0,0,1,1,1,1,0
246,5.0,CLINIQUE-Moisture Surge™ 100H Auto-Replenishing Hydrator (Limited Edition),1,1,1,1,1,0,0,0,0,1,0,0,0,0,0,0,0,0,0,0,1,1,0,0,0,0,1,1,1,1,1
247,4.3,MAC COSMETICS-Lightful C³ Radiant Hydration Tone-Up Cream Moisturizer,1,1,1,1,0,0,0,0,0,1,1,0,0,0,0,0,1,1,0,0,1,0,0,0,0,0,1,1,1,1,1
248,4.2,CLE DE PEAU-Hydro-Softening Lotion,1,1,1,1,1,0,0,0,0,1,1,0,0,0,0,0,1,0,0,0,0,0,1,0,0,0,1,1,1,1,1
249,5.0,SHISEIDO-Eudermine 150th Anniversary (Limited Edition),1,1,1,1,0,1,0,0,0,0,1,0,0,0,0,0,1,0,0,0,1,0,0,0,0,0,1,1,1,1,1
250,4.3,LANCÔME-Clarifique Watery Emulsion,1,1,1,1,0,0,0,0,0,1,1,0,0,0,1,0,1,1,1,0,0,0,0,1,0,0,1,1,1,1,1
251,3.8,INDIE LEE-Active Oil-Free Moisturizer,1,1,1,1,0,0,0,0,0,1,1,0,0,0,0,0,1,1,0,0,0,0,0,1,0,0,1,1,1,1,1
252,4.3,LANEIGE-Perfect Renew Youth Emulsion,1,1,1,1,0,1,0,0,0,1,1,0,1,0,0,0,1,0,0,0,1,0,0,0,0,0,1,1,1,1,0
253,4.2,GLAMGLOW-Waterburst™ Hydrated Glow Moisturizer,1,1,1,1,0,0,0,0,0,1,1,0,0,0,0,0,0,0,0,0,1,0,0,0,0,0,1,1,1,1,1
254,5.0,CLINIQUE-Clinique For Men™ Maximum Hydrator 72-Hour Auto-Replenishing Hydrator,1,1,1,1,0,0,0,0,0,1,0,0,0,0,0,0,0,0,0,0,1,0,0,0,0,0,1,1,1,1,0
255,5.0,CLE DE PEAU-Protective Fortifying Emulsion,1,1,1,1,0,0,0,0,0,1,1,0,0,0,0,0,1,0,0,0,1,0,0,0,0,0,1,1,1,1,1
256,4.2,FIRST AID BEAUTY-Ultra Repair Face Moisturizer,1,1,1,0,1,0,0,0,0,1,0,1,0,0,0,0,0,0,0,0,1,0,0,0,0,0,1,1,1,1,1
257,4.5,DIOR-Capture Totale C.E.L.L. ENERGY Firming & Wrinkle-Correcting Crème,1,1,1,1,0,1,0,0,0,0,1,1,1,0,0,0,0,0,0,0,1,0,0,0,0,0,1,1,1,1,0
258,4.6,CLINIQUE-Moisture Surge Intense 72Hr Lipid-Replenishing Hydrator,1,1,1,1,1,0,0,0,0,1,0,0,1,0,0,0,0,0,0,0,1,0,0,0,0,0,1,1,0,1,1
259,5.0,DIOR-Capture Totale Super Potent Rich Creme,1,1,1,1,0,1,0,0,0,1,0,1,1,0,0,0,1,0,0,0,1,0,0,0,0,0,1,1,1,1,1
260,4.1,LA MER-Crème De La Mer Moisturizer,0,1,0,0,0,0,0,0,0,1,1,1,0,0,0,0,0,0,0,0,1,0,0,0,0,0,1,1,1,1,1
261,4.3,SHISEIDO-Ultimune Power Infusing Concentrate (Limited Edition),1,1,1,1,0,1,0,0,0,1,0,0,0,0,0,0,1,0,0,0,1,0,0,0,0,0,1,1,1,1,1
262,4.1,GUERLAIN-Abeille Royale Day Cream,1,1,1,1,1,0,0,0,0,1,1,1,1,0,0,0,0,0,0,0,1,0,0,0,0,0,1,1,1,1,1
263,2.0,PHILOSOPHY-Hope In A Jar Water Cream Moisturizer,1,1,1,1,0,0,0,0,0,1,1,0,0,0,0,0,1,0,0,0,1,0,0,0,0,0,1,1,1,1,1
264,4.3,SULWHASOO-Essential Comfort Firming Cream,1,1,1,1,0,0,0,0,0,0,0,0,1,0,0,0,1,0,0,0,1,0,0,0,0,0,1,1,1,1,1
265,3.0,MAC COSMETICS-Lightful C³ Tone-Up Balm SPF30/PA++,1,1,1,1,0,0,0,0,0,1,1,0,0,0,0,0,1,1,0,1,0,0,0,0,0,0,1,1,1,1,1
266,4.3,MAC COSMETICS-Lightful C³ Radiant Hydration Skin Renewal Emulsion Lotion,1,1,1,1,0,0,0,0,0,1,1,0,0,0,0,0,0,1,0,0,0,0,0,1,0,0,1,1,1,1,1
267,4.3,EVE LOM-Moisture Lotion,1,1,1,1,1,0,0,0,0,1,0,0,0,1,0,0,0,0,1,0,0,0,0,1,0,0,1,1,1,1,1
268,3.0,MARIO BADESCU-Hyaluronic Dew Cream,1,1,1,1,0,0,0,0,0,1,1,0,0,0,0,0,0,0,0,0,1,1,0,0,0,0,1,1,1,1,1
269,4.1,SKIN INC-Pure Serum Infused Moisturizer,1,1,1,1,0,1,0,0,0,1,1,0,0,0,1,0,0,1,0,0,1,0,0,0,0,0,1,1,1,1,1
270,4.3,TALIKA-Skintelligence Anti-Age - Regenerating Day Cream,1,1,1,1,0,1,0,0,0,1,1,0,1,0,0,0,0,0,0,0,1,0,0,0,0,0,1,1,1,1,1
271,4.3,ALLIES OF SKIN-Multi Nutrient & Dioic Renewing Cream,1,1,1,1,0,0,0,0,0,1,1,0,0,0,0,0,0,0,1,0,1,0,0,0,0,0,1,1,1,1,1
272,4.0,BOSCIA-Chia Seed Moisture Cream,1,1,1,1,1,0,0,0,0,1,0,0,0,0,0,0,1,0,0,0,1,0,0,0,0,0,1,1,1,1,1
273,3.8,PIXI-Rose Flash Balm,1,1,1,1,1,0,0,0,0,0,0,0,0,1,0,0,0,0,0,1,0,0,0,0,0,0,1,1,1,1,0
274,4.6,SUNDAY RILEY-C.E.O. Afterglow Brightening Vitamin C Moisturizer,1,1,1,1,0,0,0,0,0,1,1,0,0,0,0,0,1,1,0,0,1,0,0,0,0,0,1,1,1,1,1
275,4.0,KENZOKI-Hydration Flow Fresh Melt-In Lotion,1,1,1,1,0,0,0,0,0,1,1,0,0,0,0,0,1,0,0,0,0,0,0,1,0,0,1,1,1,1,1
276,4.5,HERBIVORE BOTANICALS-Aquarius Pore Purifying Clarity Cream,1,1,1,1,0,0,0,0,0,1,0,0,0,0,0,0,1,0,1,0,1,0,0,0,0,0,1,1,1,1,1
277,4.0,HERBIVORE BOTANICALS-Pink Cloud Soft Moisture Cream,1,1,1,1,1,0,0,0,0,1,1,0,0,0,0,0,0,0,0,0,1,0,0,0,0,0,1,1,1,1,1
278,4.6,DR. DENNIS GROSS-Alpha Beta Daily Moisturizer,1,1,1,1,1,0,0,0,0,1,0,1,0,0,0,0,1,0,1,0,1,0,0,0,0,0,1,1,1,1,1
279,4.3,KORA ORGANICS BY MIRANDA KERR-Active Algae Lightweight Moisturizer - Refill Pod,1,1,1,1,0,0,0,0,0,1,1,1,1,0,0,0,1,1,1,0,0,1,0,0,0,0,1,1,1,1,1
280,3.0,CAUDALIE-Vinergetic C+ 3-In-1 Vitamin C Energy Moisturizer,1,1,1,1,0,1,0,0,0,1,1,1,0,0,1,0,0,0,0,0,1,0,0,0,0,0,1,1,1,1,1
281,5.0,SATURDAY SKIN-Carrot + Niacinamide Moisturizing Cream,1,1,1,1,0,1,0,0,0,1,0,0,0,0,0,0,1,0,0,0,1,0,0,0,0,0,1,1,1,1,1
282,4.3,SHISEIDO-Vital-perfection White Revitalizing Emulsion Enriched,1,1,1,1,0,1,0,0,0,1,1,1,1,0,1,0,1,0,0,0,0,0,1,0,0,0,1,1,1,1,1
283,4.3,INNISFREE-Green Tea Seed Cream,1,1,1,1,1,0,0,0,0,1,1,1,0,0,0,0,1,0,0,0,1,0,0,0,0,0,1,1,1,1,1
284,4.3,SHISEIDO-Vital-perfection White Revitalizing Emulsion,1,1,1,1,0,1,0,0,0,1,1,1,1,0,1,0,1,0,0,0,0,0,1,0,0,0,1,1,1,1,1
285,4.4,NUDESTIX-Citrus-C Mask & Daily Moisturizer,1,1,1,1,0,0,0,1,0,1,1,0,0,1,0,0,1,0,0,0,1,0,0,0,0,0,1,1,1,1,1
286,4.3,LA MER-The Restored And Refresh Collection (Christmas Limited Edition),1,1,1,1,0,0,0,0,1,1,0,1,0,0,0,0,1,0,0,0,1,0,1,0,0,0,1,1,1,1,1
287,4.3,DIOR-Hydra Life Deep Hydration Sorbet Water Essence,1,1,1,1,0,0,0,0,0,1,0,0,1,0,0,0,0,1,0,0,0,0,1,1,0,0,1,1,1,1,0
288,4.3,ORIGINS-Youth Fantastic Plantscription™ Line-Smoothing & Rejuvenating Trio Christmas (Limited Edition),1,1,1,1,0,1,0,0,0,1,0,1,1,0,0,0,1,0,1,0,1,0,1,0,0,0,1,1,1,1,1
289,4.3,KOPARI-Moisture Whipped Ceramide Cream,1,1,1,1,0,0,0,0,0,1,0,0,0,0,0,0,0,0,0,0,1,0,0,0,0,0,1,1,1,1,1
290,5.0,CLINIQUE-Repairwear Laser Focus Line Smoothing Cream Broad Spectrum SPF 15,1,1,1,1,0,1,0,0,0,1,0,1,1,0,0,0,0,0,0,0,1,0,0,0,0,0,1,1,1,1,0
291,4.1,ESTÉE LAUDER-Nutritious Super-Pomegranate Radiant Energy Moisture Crème,1,1,1,1,1,0,0,0,0,1,1,0,1,0,0,0,0,0,0,0,1,0,0,0,0,0,1,1,1,1,1
292,4.2,CLINIQUE-Even Better Brighter Moisture Cream,0,1,0,0,0,0,0,0,0,1,0,0,0,0,1,0,0,0,0,0,1,0,0,0,0,0,1,1,1,1,1
293,4.8,BY TERRY-Baume De Rose Face Cream,1,1,1,1,1,0,0,0,0,1,0,0,0,0,0,0,0,0,0,0,1,0,0,0,0,0,1,1,1,1,1
294,4.3,EVE LOM-TLC Moisturizing Cream,1,1,1,1,1,0,0,0,0,1,0,0,0,0,0,0,0,0,0,0,1,0,0,0,0,0,1,1,1,1,1
295,4.3,TATCHA-The Silk Cream,1,1,1,0,0,0,0,0,0,1,0,1,1,0,0,0,0,0,0,0,1,1,0,0,0,0,1,1,1,1,1
296,4.3,LA MER-Blue Heart Crème De La Mer (Limited Edition),1,1,1,1,0,1,0,0,0,1,0,1,0,0,0,0,1,0,0,0,1,0,0,0,0,0,1,1,1,1,1
297,5.0,WEI-Royal Ming Empress Cream Moisturiser,1,1,1,1,1,0,0,0,0,1,1,1,1,0,1,0,1,1,0,0,1,0,0,0,0,0,1,1,1,1,1
298,4.4,AUGUSTINUS BADER-The Cream,1,1,1,1,0,0,0,0,0,1,1,1,0,0,0,0,1,0,0,0,1,0,0,0,0,0,1,1,1,1,1
299,4.3,AUGUSTINUS BADER-The Rich Cream,1,1,1,1,1,0,0,0,0,1,1,0,1,0,0,0,1,1,0,0,1,0,0,0,0,0,1,1,1,1,1
300,4.7,LANCÔME-Clarifique Brightening Plumping Milky Cream,1,1,1,1,1,1,0,0,0,1,1,0,0,1,1,0,1,1,1,0,1,0,0,0,0,0,1,1,1,1,1
301,4.8,LANEIGE-Time Freeze Intensive Cream EX,1,1,1,1,1,1,0,0,0,1,0,0,1,0,0,0,1,0,0,0,1,0,0,0,0,0,1,1,1,1,1
302,4.0,ORIGINS-Ginzing Oil-Free Energy-Boosting Gel Moisturizer,1,1,1,1,0,0,0,0,0,1,1,0,0,0,0,0,0,0,0,0,0,1,0,0,0,0,1,1,1,1,1
303,4.0,PAI SKINCARE-The Pioneer Re-Balance Geranium & Thistle Moisturizer,1,0,1,1,0,0,0,0,0,1,0,0,0,0,0,0,0,1,0,0,1,0,0,0,0,0,1,1,1,1,1
304,4.4,KORA ORGANICS BY MIRANDA KERR-Purifying Moisturizer,1,1,1,1,0,0,0,0,0,1,0,0,0,0,0,0,0,0,0,0,1,0,0,0,0,0,1,1,1,1,1
305,4.3,STARSKIN-ORGLAMIC™ Celery Juice Serum-in-Oil Emulsion,1,1,1,1,1,0,0,0,0,1,1,0,0,0,0,0,0,0,0,0,0,0,0,0,1,0,1,1,1,1,0
306,4.4,SEPHORA COLLECTION-Nourishing Moisturizer,0,1,1,0,0,0,0,0,0,1,0,0,0,0,0,0,0,0,0,0,1,0,0,0,0,0,1,1,1,1,1
307,4.6,SEPHORA COLLECTION-Men Smoothing Hydrating Lotion,1,1,1,1,0,0,0,0,0,1,0,1,1,0,0,0,0,0,0,0,0,0,0,1,0,0,1,1,1,1,1
308,4.0,DR. DENNIS GROSS-Alpha Beta Pore Perfecting Moisturizer,1,1,1,1,1,0,0,0,0,0,0,1,1,0,0,0,1,0,1,0,1,0,0,0,0,0,1,1,1,1,1
309,4.3,SKYN ICELAND-The Antidote Cooling Daily Lotion,1,1,1,1,1,0,0,1,0,1,0,0,0,0,0,0,0,0,0,0,0,0,0,1,0,0,1,1,1,1,1
310,4.6,GALLINÉE-Hydrating Face Cream,1,1,1,1,1,0,0,0,0,1,1,0,0,0,0,0,0,1,0,0,1,0,0,0,0,0,1,1,1,1,1
311,4.2,FIRST AID BEAUTY-Skin Rescue Daily Face Cream,1,1,1,1,1,0,0,1,0,1,0,0,0,1,0,0,0,0,0,0,1,0,0,0,0,0,1,1,1,1,1
312,5.0,WEI-Royal Ming Imperial Lotion Moisturiser,1,1,1,1,1,0,0,0,0,1,1,1,0,0,1,0,1,1,0,0,0,0,1,1,0,0,1,1,1,1,1
313,5.0,BOBBI BROWN-Vitamin Enriched Face Base Moisturizer and Primer Duo,1,1,1,1,0,0,0,0,0,1,0,0,0,0,0,0,1,0,0,0,1,0,0,0,0,0,1,1,1,1,1
314,4.3,SKYN ICELAND-The Antidote Cooling Daily Lotion,1,1,1,1,1,0,0,1,0,1,0,0,0,0,0,0,0,0,0,0,0,0,0,1,0,0,1,1,1,1,1
315,4.6,GALLINÉE-Hydrating Face Cream,1,1,1,1,1,0,0,0,0,1,1,0,0,0,0,0,0,1,0,0,1,0,0,0,0,0,1,1,1,1,1
316,5.0,WEI-Royal Ming Imperial Lotion Moisturiser,1,1,1,1,1,0,0,0,0,1,1,1,0,0,1,0,1,1,0,0,0,0,1,1,0,0,1,1,1,1,1
317,5.0,BOBBI BROWN-Vitamin Enriched Face Base Moisturizer and Primer Duo,1,1,1,1,0,0,0,0,0,1,0,0,0,0,0,0,1,0,0,0,1,0,0,0,0,0,1,1,1,1,1
318,4.9,ORIGINS-GinZing™ Radiance Serum & Oil-Free Moisturizer Duo (Limited Edition),1,1,1,1,0,0,0,0,0,1,1,0,0,0,0,0,1,0,1,0,1,0,1,0,0,0,1,1,1,1,1
319,4.0,SULWHASOO-Essential Balancing Emulsion EX Moisturiser,1,1,1,1,0,0,0,0,0,1,1,0,0,0,0,0,1,0,0,0,0,0,0,1,0,0,1,1,1,1,1
320,4.4,ORIGINS-Make A Difference™ Plus+ Rejuvenating Treatment,0,1,1,0,0,0,0,0,0,1,0,0,0,0,0,0,0,0,0,0,1,0,0,0,0,0,1,1,1,1,1
321,4.3,SHISEIDO-White Lucent Brightening Day Emulsion,1,1,1,1,1,1,0,0,0,0,0,1,1,0,0,0,0,0,0,0,1,0,0,0,0,0,1,1,1,1,1
322,4.0,FIRST AID BEAUTY-Coconut Water Cream,1,1,1,1,0,0,0,0,0,1,0,0,0,0,0,0,1,0,0,0,1,0,0,0,0,0,1,1,1,1,0
323,4.0,THE INKEY LIST-Omega Water Cream,1,1,1,1,0,0,0,0,0,1,0,0,0,0,0,0,0,0,0,0,1,1,0,0,0,0,1,1,1,1,1
324,4.4,TATCHA-The Water Cream,1,1,1,1,1,1,0,0,0,1,1,0,0,0,0,0,1,0,1,0,1,0,0,0,0,0,1,1,1,1,1
325,4.8,LA MER-The Hydrating Infused Emulsion - Moisturizer,1,1,1,1,0,0,0,0,0,1,1,0,0,0,0,0,0,0,0,0,1,0,0,0,0,0,1,1,1,1,1
326,4.2,SEPHORA COLLECTION-Original Brightening Eye Cream,1,1,1,1,0,1,0,0,1,0,0,0,0,0,0,1,0,0,0,0,1,1,0,0,0,0,1,1,1,1,0
327,3.5,CHARLOTTE TILBURY-Charlotte's Magic Cream Light Moisturiser,1,1,1,1,1,0,0,0,0,1,1,1,0,0,0,0,0,0,0,0,1,0,0,0,0,0,1,1,1,1,1
328,3.9,BYBI BEAUTY-Blueberry Booster,1,1,1,1,0,0,0,0,0,0,1,0,0,0,0,0,0,0,0,0,0,0,1,0,0,0,1,1,1,1,1
329,4.2,ERNO LASZLO-Firmarine Moisturizer SPF 30,1,1,1,1,0,0,0,0,0,1,0,0,1,0,0,0,0,0,0,0,1,0,0,0,0,0,0,1,1,1,0
330,4.2,SKYN ICELAND-Pure Cloud Cream,1,1,1,1,1,0,0,1,0,1,0,0,0,0,0,0,1,0,0,0,1,0,0,0,0,0,1,1,1,1,1
331,4.3,AMUSE-Phytoncica™ B5 Triple Hyaluronic Acid Essence,1,1,1,1,0,0,0,0,0,1,0,1,0,0,0,0,0,0,0,0,0,0,1,0,0,0,1,1,1,1,1
332,5.0,MAC COSMETICS-Mineralize Time Check Lotion,0,1,1,0,0,1,0,0,0,1,0,0,0,0,0,0,1,0,1,0,0,0,0,1,0,0,1,1,1,1,0
333,4.3,PHILOSOPHY-Renewed Hope In A Jar Refreshing & Refining Moisturizer,1,1,1,0,0,1,0,0,0,1,1,1,1,0,1,0,1,1,1,0,1,0,0,0,0,0,0,1,1,1,0
334,4.3,AUGUSTINUS BADER-The Light Cream,1,1,1,1,1,0,0,0,0,1,1,0,1,1,0,0,1,1,1,0,1,0,0,0,0,0,1,1,1,1,1
335,3.3,HEURE-Ageless Day Treatment Moisturiser,1,1,1,1,0,1,0,0,0,1,1,1,1,0,0,0,1,0,0,0,1,0,0,0,0,0,1,1,1,1,0
336,4.2,CAUDALIE-Vinosource Moisturizing Matifying Fluid 40ml,1,0,0,0,0,0,0,0,0,1,0,0,0,1,0,0,0,0,0,0,0,0,1,0,0,0,1,1,1,1,1
337,4.3,FOR BELOVED ONE-Melasleep Brightening Lumi's Key Lotion,1,1,1,1,1,0,0,0,0,0,1,0,0,0,1,0,1,1,0,0,0,0,0,1,0,0,1,1,1,1,1
338,4.6,PETER THOMAS ROTH-Peptide 21 Lift & Firm Moisturizer,1,1,1,1,0,1,0,0,0,0,1,0,1,0,0,0,1,1,0,0,1,0,0,0,0,0,1,1,1,1,0
339,4.3,LANCÔME-Hydra Zen Anti-Stress Moisturising Cream,1,1,1,1,1,0,0,0,0,1,0,0,0,0,0,0,0,0,0,0,1,0,0,0,0,0,1,1,1,1,0
340,3.8,BYBI BEAUTY-C-Caf Cream,1,1,1,1,0,0,0,0,0,1,1,1,0,0,0,0,0,0,0,0,1,0,0,0,0,0,1,1,1,1,0
341,4.2,GLOW RECIPE-Banana Souffle Moisture Cream,1,1,1,1,1,0,0,0,0,1,1,0,0,0,0,0,0,0,0,0,1,0,0,0,0,0,1,1,1,1,1
342,3.4,SEPHORA COLLECTION-Original Firming Day Cream,1,1,1,1,1,0,0,0,0,1,1,1,1,0,0,0,0,0,0,0,1,0,0,0,0,0,1,1,1,1,1
343,4.7,ULTRA VIOLETTE-Queen Screen Luminising Sun Serum SPF 50+,1,1,1,1,0,0,0,0,0,1,1,0,0,0,0,0,0,0,0,0,0,0,1,0,0,0,1,1,1,1,1
344,4.3,CHARLOTTE TILBURY-Magic Cream® Moisturiser Lunar New Year (Limited Edition),1,1,1,1,0,0,0,0,0,1,1,1,0,0,0,0,1,0,0,0,1,0,0,0,0,0,1,1,1,1,1
345,5.0,DR.JART+-Cicapair Tiger Grass Color Correcting Treatment,1,1,1,1,1,0,0,1,0,1,0,0,0,0,0,0,1,1,0,0,1,0,0,0,0,0,1,1,1,1,1
346,4.2,BOSCIA-Cactus Water Hydrating Cream,1,1,1,1,0,0,0,0,0,1,0,0,0,0,0,0,0,0,0,0,1,0,0,0,0,0,1,1,1,1,1
347,3.2,KOPARI-Coconut Water Moisture Cream,1,1,1,1,1,0,0,0,0,1,1,0,0,0,0,0,1,0,0,0,1,1,0,0,0,0,1,1,1,1,1
348,3.9,PIXI-Glowtion Day Dew Brightening Lotion,1,1,1,1,0,0,0,0,0,1,1,0,0,0,0,0,0,0,0,0,1,0,0,0,0,0,1,1,1,1,1
349,3.6,PIXI-H20 Skindrink,1,1,1,1,0,0,0,0,0,1,0,0,0,0,0,0,0,0,0,0,0,1,0,0,0,0,1,1,1,1,1
350,4.4,EVE LOM-Brightening Cream,1,1,1,1,0,1,0,0,0,0,1,0,1,0,1,0,0,1,0,0,1,0,0,0,0,0,1,1,1,1,0
351,4.3,CAUDALIE-Premier Cru Cream,1,1,1,1,1,1,0,0,0,0,1,1,1,0,0,0,0,0,0,0,1,0,0,0,0,0,1,1,1,1,0
352,4.2,SEPHORA COLLECTION-Original All Day Hydrator Moisturizer,1,1,1,1,0,0,0,0,0,1,1,0,0,0,0,0,0,1,0,0,1,0,0,0,0,0,1,1,1,1,0
353,4.6,KORA ORGANICS BY MIRANDA KERR-Hydrating Moisturizer,1,1,1,1,0,0,0,0,0,1,0,1,0,0,0,0,0,0,0,0,1,0,0,0,0,0,1,1,1,1,1
354,4.0,KORA ORGANICS BY MIRANDA KERR-Noni Glow Face Balm,1,1,1,1,0,0,0,0,0,1,1,0,0,0,0,0,0,0,0,1,0,0,0,0,0,0,1,1,1,1,1
