,rating,unique_id,Combination,Dry,Normal,Oily,Sensitive,Ageing,Blackheads,Blemishes,DarkCircles,Dryness,Dullness,FineLines&Wrinkles,Firmness&Elasticity,Oiliness,Pigmentation&DarkSpots,Puffiness,UnevenSkinTexture,UnevenSkinTone,VisiblePores,Balm,Bar,ClayMud,Cream,Foam,Gel,Liquid,Lotion,Oil,Powder,Wipe,20s,30s,40s,50+,Under20
0,4.4,FRESH-Soy Face Cleanser,1,1,1,1,0,1,0,0,0,1,0,0,0,0,0,0,0,0,1,0,0,0,0,0,1,0,0,0,0,0,1,1,1,1,1
1,4.0,THE ORDINARY-Squalane Cleanser,1,1,1,1,0,0,0,0,0,1,0,0,0,0,0,0,0,0,0,0,0,0,0,0,0,1,0,0,0,0,1,1,1,1,1
2,4.1,SEPHORA COLLECTION-Cleansing Face Wipe,1,1,1,1,1,0,0,0,0,0,1,0,0,0,0,0,0,0,0,0,0,0,0,0,0,0,0,0,0,1,1,1,1,1,1
3,4.7,FARMACY-Green Clean Makeup Meltaway Cleansing Balm,1,1,1,1,0,0,0,0,0,1,0,0,0,0,0,0,0,0,0,1,0,0,0,0,0,0,0,0,0,0,1,1,1,1,1
4,4.4,SEPHORA COLLECTION-Triple Action Cleansing Micellar Water,1,1,1,1,1,0,0,0,0,1,0,0,0,0,0,0,0,0,0,0,0,0,0,0,0,1,0,0,0,0,1,1,1,1,1
5,3.9,GLOW RECIPE-Blueberry Bounce Gentle Cleanser,1,1,1,1,0,0,0,0,0,1,1,0,0,0,0,0,0,0,1,0,0,0,0,0,0,1,0,0,0,0,1,1,1,1,1
6,4.4,TATCHA-Dewy Cleanse And Hydrate Duo (Christmas Limited Edition),1,1,1,1,0,0,0,0,0,1,0,0,0,0,0,0,0,0,0,0,0,0,1,0,0,1,0,0,0,0,1,1,1,1,1
7,5.0,FRESH-Skincare Prep Essentials (Christmas Limited Edition),1,1,1,1,0,0,0,0,0,1,0,0,0,0,0,0,0,0,1,0,0,0,0,0,1,1,0,0,0,0,1,1,1,1,1
8,3.8,THE INKEY LIST-Oat Cleansing Balm,1,1,1,1,1,0,0,0,0,1,0,0,0,0,0,0,1,0,0,1,0,0,0,0,0,0,0,0,0,0,1,1,1,1,1
9,4.6,SK-II-Facial Treatment Gentle Cleanser,1,1,1,1,0,0,1,0,0,1,1,0,0,0,0,0,1,0,0,0,0,0,1,0,0,0,0,0,0,0,1,1,1,1,1
10,4.4,DR.JART+-Dermaclear Micro pH Foam Facial Cleanser,1,1,0,1,1,0,0,0,0,0,1,0,0,0,0,0,0,0,0,0,0,0,0,1,1,0,0,0,0,0,1,1,1,1,1
11,4.4,TATCHA-Clarifying Cleanse And Hydrate Duo (Christmas Limited Edition),1,1,1,1,0,0,0,0,0,1,0,0,0,1,0,0,1,0,1,0,0,0,1,0,0,0,1,0,0,0,1,1,1,1,1
12,4.5,TATCHA-The Rice Wash Cleanser,1,1,1,0,0,1,0,0,0,1,1,0,0,0,0,0,1,0,0,0,0,0,1,0,0,0,0,0,0,0,1,1,1,1,1
13,4.9,SHU UEMURA-Anti/Oxi+ Pollutant And Dullness Clarifying Cleansing Oil,1,1,1,1,0,0,0,0,0,0,1,0,0,0,0,0,1,0,0,0,0,0,0,0,0,0,0,1,0,0,1,1,1,1,1
14,4.8,FRESH-Best Of Beauty Bundle (Christmas Limited Edition),1,1,1,1,0,0,0,0,0,1,1,0,0,0,0,0,0,0,1,0,0,0,1,0,0,1,0,0,0,0,1,1,1,1,1
15,4.4,FRESH-Best Selling Duo (Christmas Limited Edition),1,1,1,1,0,0,0,0,0,1,0,0,0,0,0,0,0,0,0,0,0,0,1,0,1,0,0,0,0,0,1,1,1,1,1
16,4.8,FRESH-Soy Face Cleanser (Limited-Edition),1,1,1,1,0,0,0,0,0,1,0,0,0,0,0,0,0,0,1,0,0,0,1,0,0,0,0,0,0,0,1,1,1,1,1
17,4.3,CAUDALIE-Vinoclean Instant Foaming Cleanser,1,1,1,1,0,0,0,0,0,1,0,0,0,0,0,0,0,0,0,0,0,0,0,1,0,0,0,0,0,0,1,1,1,1,1
18,4.9,SULWHASOO-Gentle Cleansing Foam,1,1,1,1,0,0,0,0,0,1,0,0,0,0,0,0,0,0,0,0,0,0,0,1,0,0,0,0,0,0,1,1,1,1,1
19,5.0,SHU UEMURA-Sailormoon Ultime8 Cleansing Oil (Christmas Limited Edition),1,1,1,1,0,0,0,0,0,1,0,0,0,0,0,0,1,0,0,0,0,0,0,0,0,0,0,1,0,0,1,1,1,1,1
20,4.5,THE INKEY LIST-Fulvic Acid Brightening Cleanser,1,1,1,1,0,0,0,0,0,0,1,0,0,0,1,0,1,1,0,0,0,0,0,0,1,0,0,0,0,0,1,1,1,1,1
21,4.2,DR. DENNIS GROSS-Alpha Beta AHA/BHA Cleansing Gel,1,1,1,1,0,0,0,0,0,0,1,1,0,0,0,0,0,0,1,0,0,0,0,0,1,0,0,0,0,0,1,1,1,1,1
22,4.0,DRUNK ELEPHANT-Beste™ No. 9 Jelly Cleanser,1,1,1,1,1,0,0,0,0,1,0,0,0,0,0,0,0,0,0,0,0,0,0,0,0,1,0,0,0,0,1,1,1,1,1
23,4.5,CAUDALIE-Vinopure Purifying Gel Cleanser,1,1,1,1,0,0,0,1,0,0,1,0,0,1,0,0,0,0,0,0,0,0,0,0,1,0,0,0,0,0,1,1,1,1,1
24,3.8,SEPHORA COLLECTION-Gentle Eye And Lip Makeup Remover,1,1,1,1,0,0,0,0,0,1,0,0,0,0,0,0,0,0,0,0,0,0,0,0,0,1,0,0,0,0,1,1,1,1,1
25,4.2,FENTY SKIN-Total Cleans'R Remove-It-All Cleanser,1,1,1,1,1,0,0,0,0,1,1,0,0,1,0,0,0,0,1,0,0,0,1,0,0,0,0,0,0,0,1,1,1,1,1
26,4.2,SHU UEMURA-Ultime8∞ Sublime Beauty Cleansing Oil,1,1,1,1,0,0,0,0,0,1,0,1,1,0,0,0,0,0,0,0,0,0,0,0,0,0,0,1,0,0,1,1,1,1,1
27,4.5,DR. DENNIS GROSS-Hyaluronic Marine Meltaway Cleanser,1,1,1,1,1,0,0,0,0,1,1,0,0,0,0,0,0,0,0,0,0,0,1,0,0,0,0,0,0,0,1,1,1,1,1
28,3.9,THE ORDINARY-Salicylic Acid 2% Anhydrous Solution,1,1,1,1,1,0,0,1,0,0,0,0,0,0,0,0,1,1,1,0,0,0,0,0,0,1,0,0,0,0,1,1,1,1,1
29,4.4,LANCÔME-Clarifique Pore Refining Cleansing Foam,1,1,1,1,1,0,0,0,0,0,1,0,0,0,0,0,0,0,1,0,0,0,0,1,0,0,0,0,0,0,1,1,1,1,1
30,4.7,FARMACY-Clearly Clean Makeup Meltaway Cleansing Balm,1,1,1,1,1,0,0,0,0,1,1,0,0,0,0,0,0,0,0,1,0,0,0,0,0,0,0,0,0,0,1,1,1,1,1
31,4.0,THE INKEY LIST-Selfless by Hyram Centella and Green Tea Daily Gel Cleanser,1,1,1,1,1,0,0,0,0,1,0,0,0,0,0,0,0,0,0,0,0,0,0,0,1,0,0,0,0,0,1,1,1,1,1
32,4.4,INDIE LEE-Brightening Cleanser,1,1,1,1,0,0,0,0,0,1,1,0,0,0,0,0,1,1,1,0,0,0,0,0,1,1,0,0,0,0,1,1,1,1,1
33,4.5,INNISFREE-Green Tea Hydration Duo,1,1,1,1,0,0,0,0,0,1,1,0,0,0,0,0,0,0,0,0,0,0,1,1,0,1,0,0,0,0,1,1,1,1,1
34,4.4,ESTÉE LAUDER-Perfectly Clean Multi-Action Foam Cleanser/Purifying Mask,1,1,1,1,0,0,0,0,0,0,1,0,0,0,0,0,0,0,0,0,0,0,0,1,0,0,0,0,0,0,1,1,1,1,1
35,5.0,SHISEIDO-Face Cleanser,1,1,1,1,0,0,0,0,0,1,0,0,0,1,0,0,1,0,0,0,0,0,0,1,0,0,0,0,0,0,1,1,1,1,1
36,4.4,TATCHA-The Camellia Cleansing Oil,1,1,1,1,0,0,0,0,0,1,0,0,0,1,0,0,0,0,0,0,0,0,0,0,0,0,0,1,0,0,1,1,1,1,1
37,4.0,INNISFREE-Bija Trouble Facial Foam,1,1,1,1,0,0,0,0,0,0,1,0,0,1,0,0,0,0,1,0,0,0,0,1,0,0,0,0,0,0,1,1,1,1,1
38,4.4,CAUDALIE-Vinoclean Makeup Removing Cleansing Oil,1,1,1,1,0,0,0,0,0,1,0,0,0,0,0,0,0,0,0,0,0,0,0,0,0,0,0,1,0,0,1,1,1,1,1
39,4.6,BOBBI BROWN-Soothing Cleansing Oil,1,1,1,1,1,0,0,0,0,1,0,0,0,0,0,0,0,0,0,0,0,0,0,0,0,0,0,1,0,0,1,1,1,1,1
40,4.1,MARIO BADESCU-Acne Facial Cleanser,1,0,0,1,0,0,0,1,0,0,0,0,0,0,0,0,0,0,0,0,0,0,0,0,0,1,0,0,0,0,1,1,1,1,1
41,4.1,LA MER-The Cleansing Foam,1,1,1,1,0,0,0,0,0,0,1,0,0,1,0,0,0,1,0,0,0,0,0,1,0,0,0,0,0,0,1,1,1,1,1
42,4.1,MARIO BADESCU-Enzyme Cleansing Gel,1,0,0,1,0,0,0,0,0,0,0,0,0,1,0,0,0,0,0,0,0,0,0,0,1,0,0,0,0,0,1,1,1,1,1
43,4.5,PHILOSOPHY-Purity Made Simple One-Step Facial Cleanser,1,1,1,1,1,0,0,0,0,1,0,0,0,0,0,0,0,0,1,0,0,0,0,0,0,1,0,0,0,0,1,1,1,1,1
44,5.0,ELEMIS-Superfood Facial Wash,1,1,1,1,0,0,0,0,0,1,1,0,0,0,0,0,0,0,0,0,0,0,0,0,1,0,0,0,0,0,1,1,1,1,1
45,4.5,CAUDALIE-Vinoclean Micellar Cleansing Water,1,1,1,1,1,0,0,0,0,1,0,0,0,0,0,0,0,0,0,0,0,0,0,0,0,1,0,0,0,0,1,1,1,1,1
46,4.5,IT COSMETICS-Confidence In A Cleanser,1,1,1,1,1,0,0,0,0,1,0,0,0,0,0,0,0,0,0,0,0,0,1,0,0,0,0,0,0,0,1,1,1,1,1
47,4.6,SEPHORA COLLECTION-Cleansing & Hydrating Micellar Water,1,1,1,1,1,0,0,0,0,1,0,0,0,0,0,0,1,0,0,0,0,0,0,0,0,1,0,0,0,0,1,1,1,1,1
48,4.2,GLOW RECIPE-Papaya Sorbet Enzyme Cleansing Balm,1,1,1,1,0,0,0,0,0,1,1,0,0,0,0,0,0,0,0,1,0,0,1,0,0,0,0,0,0,0,1,1,1,1,1
49,4.4,CHARLOTTE TILBURY-Take It All Off,1,1,1,1,1,0,0,0,0,0,0,1,0,0,0,1,1,0,0,0,0,0,0,0,0,1,0,0,0,0,1,1,1,1,1
50,4.4,ORIGINS-Checks and Balances™ Frothy Face Wash,1,1,1,1,0,0,0,0,0,1,0,0,0,1,0,0,0,0,0,0,0,0,1,0,0,0,0,0,0,0,1,1,1,1,1
51,3.9,SUNDAY RILEY-Ceramic Slip Clay Cleanser,1,1,1,1,1,1,0,1,0,0,1,0,0,1,1,0,1,1,1,0,0,0,0,0,0,1,0,0,0,0,1,1,1,1,1
52,3.9,FRESH-Rose Cleansing Foam,1,1,1,1,1,1,0,0,0,1,1,0,1,0,0,0,1,0,0,0,0,0,0,1,0,0,0,0,0,0,1,1,1,1,0
53,4.6,CLINIQUE-All About Clean 2-in-1 Cleansing + Exfoliating Jelly Anti-Pollution,1,1,1,1,0,0,0,0,0,0,1,0,0,0,0,0,1,0,1,0,0,0,0,0,1,0,0,0,0,0,1,1,1,1,1
54,4.3,OLE HENRIKSEN-Truth Juice™ Daily Cleanser,1,1,1,1,0,0,0,0,0,0,1,0,0,0,0,0,0,0,0,0,0,0,1,0,1,0,0,0,0,0,1,1,1,1,1
55,4.7,LANEIGE-Water Bank Blue Hyaluronic Cleansing Foam,1,1,1,1,0,0,0,0,0,0,1,0,0,0,0,0,0,0,1,0,0,0,0,1,0,0,0,0,0,0,1,1,1,1,1
56,4.4,FRESH-Kombucha Cleansing Treatment,1,1,1,1,0,0,0,0,0,0,0,0,0,0,0,0,1,0,1,0,0,0,0,0,0,1,0,0,0,0,1,1,1,1,1
57,4.6,FARMACY-Whipped Greens oil-free foaming cleanser,1,1,1,1,0,0,0,0,0,0,1,0,0,1,0,0,0,0,1,0,0,0,1,0,0,0,0,0,0,0,1,1,1,1,1
58,5.0,FRESH-Day & Night Hydration (Christmas Limited Edition),1,1,1,1,0,1,0,0,0,1,1,0,0,0,0,0,0,0,0,0,0,0,1,0,1,0,0,0,0,0,1,1,1,1,1
59,4.4,DIOR-La Mousse Off/On Foaming Cleanser,1,1,1,1,0,0,0,0,0,1,1,0,0,0,0,0,0,0,0,0,0,0,0,1,0,0,0,0,0,0,1,1,1,1,1
60,3.9,SULWHASOO-Gentle Cleansing Oil,1,1,1,1,0,0,0,0,0,1,1,0,0,0,0,0,0,0,0,0,0,0,0,0,0,0,0,1,0,0,1,1,1,1,1
61,4.4,CLINIQUE-All About Clean™ Liquid Facial Soap (Oily Skin),1,0,0,1,0,0,0,0,0,1,0,0,0,0,0,0,0,0,0,0,0,0,0,0,0,1,0,0,0,0,1,1,1,1,1
62,4.4,CLINIQUE-All About Clean™ Liquid Facial Soap (Mild),1,0,1,0,1,0,0,0,0,1,0,0,0,1,0,0,0,0,0,0,0,0,0,0,0,1,0,0,0,0,1,1,1,1,1
63,3.8,DRUNK ELEPHANT-Slaai™ Makeup-Melting Butter Cleanser,1,1,1,1,1,0,0,0,0,1,1,0,0,0,0,0,1,1,0,1,0,0,0,0,0,1,0,1,0,0,1,1,1,1,1
64,4.3,SEPHORA COLLECTION-Brightening Dual Exfoliator,1,1,1,1,0,0,0,0,0,0,1,0,0,0,0,0,1,0,0,0,0,0,0,0,0,1,0,0,0,0,1,1,1,1,1
65,4.3,CLE DE PEAU-Clarifying Cleansing Foam,1,1,1,1,0,0,0,0,0,0,1,0,0,0,0,0,0,0,0,0,0,0,0,1,0,0,0,0,0,0,1,1,1,1,1
66,4.3,BOSCIA-Detoxifying Black Charcoal Cleanser,1,1,1,1,1,0,0,0,0,0,1,0,0,1,0,0,1,1,1,0,0,0,0,0,1,0,0,0,0,0,1,1,1,1,1
67,4.2,SEPHORA COLLECTION-Exfoliating Face Wipe,1,1,1,1,0,0,0,0,0,1,1,0,0,0,0,0,0,1,0,0,0,0,0,0,0,0,0,0,0,1,1,1,1,1,1
68,4.4,FIRST AID BEAUTY-Face Cleanser,1,1,1,1,1,0,0,0,0,1,0,0,0,0,0,0,0,0,1,0,0,0,1,0,0,0,0,0,0,0,1,1,1,1,1
69,4.8,CAUDALIE-Vinoclean Instant Foaming Cleanser Duo,1,1,1,1,0,0,0,0,0,1,1,0,0,0,0,0,0,0,0,0,0,0,0,1,0,0,0,0,0,0,1,1,1,1,1
70,4.6,PHILOSOPHY-The Microdelivery Exfoliating Facial Wash,1,1,1,1,0,0,0,0,0,1,1,0,0,0,0,0,0,1,0,0,0,0,0,0,0,1,0,0,0,0,1,1,1,1,1
71,4.7,SHU UEMURA-Blanc:Chroma Lightening & Polishing Cleansing Oil,1,1,1,1,0,0,0,0,0,0,1,0,0,0,0,0,0,1,0,0,0,0,0,0,0,0,0,1,0,0,1,1,1,1,1
72,5.0,LAB SERIES-Oil Control Clay Cleanser + Mask,1,1,1,1,0,0,0,1,0,0,0,0,0,1,0,0,0,0,1,0,0,1,0,0,0,0,0,0,0,0,1,1,1,1,1
73,4.4,TATCHA-The Deep Cleanse,1,1,1,1,0,0,0,0,0,0,1,0,0,1,0,0,1,0,0,0,0,0,0,0,0,1,0,0,0,0,1,1,1,1,1
74,2.5,CLINIQUE-Take the Day Off Micellar Cleansing Towelettes for Face & Eyes,1,1,1,1,1,0,0,0,0,1,0,0,0,0,0,0,0,0,1,0,0,0,0,0,0,0,0,0,0,1,1,1,1,1,1
75,4.5,SEPHORA COLLECTION-Smoothing Cleanser,1,1,1,1,0,0,0,0,0,0,1,0,0,0,0,0,1,0,1,0,0,0,0,0,1,0,0,0,0,0,1,1,1,1,1
76,4.3,CAUDALIE-Vinoclean Gentle Cleansing Almond Milk,1,1,1,1,1,0,0,0,0,1,0,0,0,0,0,0,1,0,0,0,0,0,0,0,0,1,0,0,0,0,1,1,1,1,1
77,3.8,EVE LOM-Cleansing Oil Capsules,1,1,1,1,1,0,0,0,0,1,0,0,0,0,0,0,0,0,0,0,0,0,0,0,0,0,0,1,0,0,1,1,1,1,1
78,4.9,MAKE UP FOR EVER-So Divine,1,1,1,1,1,0,0,0,0,1,0,0,0,0,0,0,0,0,0,0,0,0,1,0,0,0,0,0,0,0,1,1,1,1,1
79,4.3,DR.JART+-Ctrl-A Teatreement™ Cleansing Foam,1,0,0,1,0,0,0,1,0,1,0,0,0,1,0,0,0,0,0,0,0,0,0,1,0,0,0,0,0,0,1,1,1,1,1
80,4.4,DERMALOGICA CLEAR START-Breakout Clearing Foaming Wash,1,1,1,1,0,0,0,1,0,0,0,0,0,1,0,0,0,0,0,0,0,0,0,1,0,0,0,0,0,0,1,1,1,1,1
81,4.8,SK-II-MEN Moisturizing Cleanser,1,1,1,1,0,0,1,0,0,1,0,0,0,1,0,0,0,0,1,0,0,0,1,0,0,0,0,0,0,0,1,1,1,1,1
82,4.3,ESTÉE LAUDER-Nutritious Super-Pomegranate Radiant Energy 2-in-1 Cleansing Foam,1,1,1,1,0,0,0,0,0,0,1,0,1,0,0,0,0,0,0,0,0,0,0,1,0,0,0,0,0,0,1,1,1,1,1
83,4.6,DERMALOGICA-Special Cleansing Gel,1,1,1,1,0,0,0,0,0,1,0,0,0,0,0,0,1,0,0,0,0,0,0,0,1,0,0,0,0,0,1,1,1,1,1
84,4.2,THE INKEY LIST-Hyaluronic Acid Cleanser,1,1,1,1,1,0,0,0,0,1,1,0,0,0,0,0,0,0,0,0,0,0,0,0,0,1,0,0,0,0,1,1,1,1,1
85,4.2,THIS WORKS-Evening Detox Cleansing Water,1,1,1,1,0,0,0,0,0,0,0,0,0,1,0,0,0,0,1,0,0,0,0,0,0,1,0,0,0,0,1,1,1,1,1
86,4.3,DR.JART+-Dermaclear Micro Foam Cleanser,1,1,1,1,1,0,0,0,0,0,1,0,0,0,0,0,0,0,0,0,0,0,1,1,0,0,0,0,0,0,1,1,1,1,1
87,4.4,SHISEIDO-Ultimune Essential Defense Trio,1,1,1,1,0,0,0,0,0,1,1,0,0,0,0,0,0,0,0,0,0,0,1,0,0,1,0,0,0,0,1,1,1,1,1
88,4.8,SK-II-Facial Treatment Cleansing Gel,1,0,0,0,0,0,0,0,0,0,1,0,0,0,0,0,1,0,1,0,0,0,0,0,1,0,0,0,0,0,1,1,1,1,1
89,3.8,ESTÉE LAUDER-Advanced Night Micro Cleansing Foam,1,1,1,1,0,0,0,0,0,1,0,0,0,0,0,0,0,0,0,0,0,0,0,1,0,0,0,0,0,0,1,1,1,1,1
90,4.4,CLINIQUE-All About Clean™ Rinse-Off Foaming Cleanser,1,1,1,1,1,0,0,0,0,1,0,0,0,0,0,0,0,0,0,0,0,0,1,1,0,0,0,0,0,0,1,1,1,1,1
91,4.4,SEPHORA COLLECTION-Prebiotic Clean Skin Gel Cleanser,1,1,1,1,0,0,0,0,0,1,1,0,0,0,0,0,0,0,0,0,0,0,0,0,1,0,0,0,0,0,1,1,1,1,1
92,4.4,BIOSSANCE-Squalane + Amino Aloe Gentle Cleanser,1,1,1,1,0,0,0,0,0,1,1,0,0,0,0,0,1,0,1,0,0,0,0,1,1,0,0,0,0,0,1,1,1,1,1
93,4.4,DIOR-Micellar Water Cleanser,1,1,1,1,0,0,0,0,0,1,0,0,0,0,0,0,1,0,0,0,0,0,0,0,0,1,0,0,0,0,1,1,1,1,1
94,3.8,ESTÉE LAUDER-Perfectly Clean Multi-Action Creme Cleanser/Moisture Mask,1,1,1,1,0,0,0,0,0,0,1,0,0,1,0,0,0,0,0,0,0,0,1,0,0,0,0,0,0,0,1,1,1,1,1
95,4.4,OLE HENRIKSEN-Find Your Balance Oil Control Cleanser,1,0,1,1,0,0,0,0,0,0,0,0,0,1,0,0,0,0,1,0,0,0,0,1,0,0,0,0,0,0,1,1,1,1,1
96,3.7,MARIO BADESCU-Botanical Facial Gel,1,0,0,1,0,0,0,0,0,0,0,0,0,1,0,0,0,0,0,0,0,0,0,0,0,1,0,0,0,0,1,1,1,1,1
97,3.8,PIXI-PinkSalt Cleansing Oil,1,1,1,0,0,0,0,0,0,1,1,0,0,1,0,0,0,0,0,0,0,0,0,0,0,0,0,1,0,0,1,1,1,1,1
98,4.4,DIOR-Eye and Lip Makeup Remover,1,1,1,1,1,0,0,0,0,0,0,0,0,0,0,0,1,0,0,0,0,0,0,0,0,1,0,0,0,0,1,1,1,1,1
99,4.3,PHILOSOPHY-Purity Made Simple One-Step Mattifying Facial Cleanser,1,1,1,1,0,0,0,0,0,1,1,0,0,0,0,0,0,0,0,0,0,0,0,0,0,1,0,0,0,0,1,1,1,1,1
100,4.0,GALLINÉE-Perfume Free Cleansing Bar,1,1,1,1,1,0,0,0,0,1,0,0,0,0,0,0,0,0,0,0,1,0,0,0,0,0,0,0,0,0,1,1,1,1,1
101,4.4,LANCÔME-Gel Eclat Clarifying Facial Cleanser,1,1,1,1,0,0,0,0,0,1,0,0,0,0,0,0,0,0,0,0,0,0,0,1,0,0,0,0,0,0,1,1,1,1,1
102,4.4,SHISEIDO-Clarifying Cleansing Foam,1,1,1,1,1,0,0,0,0,1,1,0,0,0,0,0,0,0,0,0,0,0,0,1,0,0,0,0,0,0,1,1,1,1,0
103,4.0,SHISEIDO-Deep Cleansing Foam,1,0,0,1,0,0,0,1,0,0,0,0,0,1,0,0,0,0,0,0,0,0,0,1,0,0,0,0,0,0,1,1,1,1,0
104,4.6,LANEIGE-Cream Skin Milk Oil Cleanser,1,1,1,1,1,0,0,0,0,1,0,0,0,1,0,0,0,0,1,0,0,0,0,0,0,1,0,1,0,0,1,1,1,1,1
105,4.8,THREE-Balancing Cleansing Oil R,1,1,1,0,0,0,0,0,0,1,1,0,0,0,0,0,0,0,0,0,0,0,0,0,0,0,0,1,0,0,1,1,1,1,1
106,4.4,DRGL-Cleanser Sensitive,1,1,1,1,1,0,1,0,1,1,1,0,0,0,0,0,0,0,0,0,0,0,0,0,0,1,0,0,0,0,1,1,1,1,1
107,4.5,FRESH-Seaberry Skin Nutrition Cleansing Oil,1,1,1,0,0,0,0,0,0,1,0,0,0,0,0,0,0,0,0,0,0,0,0,0,0,0,0,1,0,0,0,1,1,1,0
108,4.3,MARIO BADESCU-Glycolic Foaming Cleanser,1,1,1,1,1,0,0,0,0,0,0,1,0,0,1,0,1,0,0,0,0,0,0,0,0,1,0,0,0,0,1,1,1,1,1
109,3.5,PIXI-Skintreats Clarity Cleanser,1,1,1,1,0,0,0,0,0,1,1,0,0,0,0,0,0,0,1,0,0,0,1,0,0,0,0,0,0,0,1,1,1,1,1
110,1.0,BOSCIA-Cryosea Firming Icy-Cold Cleanser,1,1,1,1,0,0,0,0,0,1,1,1,1,0,0,0,1,0,0,0,0,0,0,0,0,1,0,0,0,0,1,1,1,1,1
111,4.1,TARTE-Knockout Daily Exfoliating Cleanser,1,1,1,1,1,0,0,0,0,0,0,0,0,0,0,0,1,0,1,0,0,0,0,0,1,0,0,0,0,0,1,1,1,1,1
112,3.7,BIOSSANCE-Squalane + Elderberry Jelly Cleanser,1,1,1,1,0,1,0,0,0,1,1,0,0,0,0,0,0,0,0,0,0,0,0,0,1,0,0,0,0,0,0,1,1,1,0
113,3.9,PIXI-Rose Cream Cleanser,1,1,1,1,0,0,0,0,0,0,0,0,0,1,0,0,0,0,0,0,0,0,1,0,0,0,0,0,0,0,1,1,1,1,1
114,4.4,MARIO BADESCU-Cleansing Oil,1,1,1,1,0,0,0,0,0,1,0,0,0,0,0,0,0,0,1,0,0,0,0,0,0,0,0,1,0,0,1,1,1,1,1
115,3.5,CAUDALIE-Skincare Bestie Box,1,1,1,1,0,0,1,1,0,1,1,0,0,1,1,0,0,0,1,0,0,0,1,0,1,1,0,0,0,0,1,1,1,1,1
116,4.5,ORIGINS-Dr. Weil For Origins™ Mega-Mushroom Skin Relief Micellar Cleanser,1,1,1,1,1,0,0,0,0,1,0,0,0,0,0,0,0,0,0,0,0,0,0,0,0,1,0,0,0,0,1,1,1,1,1
117,4.4,ELEMIS-Superfood AHA Glow Cleansing Butter,1,1,1,1,0,0,0,0,0,1,1,0,0,0,0,0,0,0,0,0,0,0,1,0,0,0,0,0,0,0,1,1,1,1,1
118,4.7,TATCHA-The Texture Tonic,1,1,1,1,0,0,0,0,0,1,1,0,0,1,0,0,1,1,1,0,0,0,0,0,0,1,0,0,0,0,1,1,1,1,1
119,4.3,INDIE LEE-Purifying Face Wash,1,1,1,1,0,0,0,0,0,1,1,0,0,1,0,0,1,1,1,0,0,0,0,0,0,1,0,0,0,0,1,1,1,1,1
120,5.0,SHISEIDO-Complete Cleansing Microfoam,1,1,1,1,0,0,0,0,0,1,0,0,0,0,0,0,1,0,0,0,0,0,0,1,0,0,0,0,0,0,1,1,1,1,1
121,4.4,SHISEIDO-Waso Quick Gentle Cleanser,1,1,1,1,0,0,0,0,0,0,0,0,0,0,0,0,0,0,0,0,0,0,0,0,1,0,0,0,0,0,1,1,1,1,1
122,4.5,DR.JART+-Cicapair Enzyme Cleansing Foam,1,1,1,1,0,0,0,0,0,1,0,0,0,0,0,0,1,0,0,0,0,0,0,1,0,0,0,0,0,0,1,1,1,1,1
123,4.7,TATCHA-The Rice Polish Foaming Enzyme Powder,1,1,1,1,0,0,0,0,0,0,1,0,0,0,0,0,1,1,0,0,0,0,0,0,0,0,0,0,1,0,1,1,1,1,1
124,5.0,GALLINÉE-Face Foaming Cleanser,1,1,1,1,1,0,0,0,0,1,0,0,0,0,0,0,1,0,1,0,0,0,0,1,0,0,0,0,0,0,1,1,1,1,1
125,4.6,LANCÔME-Crème Mousse-Confort,1,1,1,1,0,0,0,0,0,1,0,0,0,0,0,0,0,0,0,0,0,0,0,1,0,0,0,0,0,0,1,1,0,0,1
126,4.4,LAB SERIES-Anti-Age Max LS Cleanser,1,1,1,1,0,1,0,0,0,1,0,0,0,0,0,0,1,0,0,0,0,0,0,0,0,1,0,0,0,0,1,1,1,1,1
127,4.4,MALIN + GOETZ-Grapefruit Face Cleanser,1,1,1,1,1,0,0,0,0,1,0,0,0,0,0,0,0,0,0,0,0,0,0,0,1,0,0,0,0,0,1,1,1,1,1
128,4.3,SHISEIDO-Future Solution LX Extra Rich Cleansing Foam,1,1,1,1,0,1,0,0,0,0,1,0,0,1,0,0,1,0,0,0,0,0,1,1,0,0,0,0,0,0,1,1,1,1,1
129,4.4,FRANK BODY-Charcoal Face Cleanser,1,1,1,1,1,0,0,0,0,1,1,1,0,0,0,0,1,0,0,0,0,0,1,0,0,0,0,0,0,0,1,1,1,1,1
130,4.0,PAI SKINCARE-Light Work Rosehip Fruit Extract Cleansing Oil,1,1,1,1,0,0,0,0,0,0,1,0,0,0,0,0,0,0,0,0,0,0,0,0,0,0,0,1,0,0,1,1,1,1,1
131,5.0,PIXI-Hydrating Milky Cleanser,1,1,1,1,0,0,0,0,0,1,0,0,0,0,0,0,0,0,0,0,0,0,1,0,0,0,0,0,0,0,1,1,1,1,1
132,4.5,BOSCIA-Purifying Cleansing Gel,1,1,1,1,1,0,0,1,0,1,1,0,0,1,0,0,1,1,1,0,0,0,0,0,1,0,0,0,0,0,1,1,1,1,1
133,3.8,PIXI-Retinol Jasmine Cleanser,1,1,1,1,1,0,0,0,0,1,1,0,1,0,0,0,1,1,0,0,0,0,1,0,0,0,0,0,0,0,1,1,1,1,1
134,4.3,ALLIES OF SKIN-Molecular Silk Amino Hydrating Cleanser,1,1,1,1,0,0,0,0,0,1,1,0,0,0,1,0,1,0,0,0,0,0,0,0,0,0,0,1,0,0,1,1,1,1,1
135,4.1,BIOSSANCE-Squalane + Antioxidant Cleansing Oil,1,1,1,1,0,0,0,0,0,1,0,0,0,0,0,0,0,0,0,0,0,0,0,0,0,0,0,1,0,0,1,1,1,1,0
136,5.0,DIOR-Diorsnow Essence Of Light Purifying Brightening Foam,1,1,1,1,0,0,0,0,0,0,1,0,0,0,0,0,0,0,0,0,0,0,0,1,0,0,0,0,0,0,1,1,1,1,1
137,5.0,CLINIQUE-All About Clean™ Foaming Facial Soap,1,1,1,1,0,0,0,0,0,1,0,0,0,0,0,0,0,0,0,0,0,0,1,0,0,0,0,0,0,0,1,1,1,1,1
138,4.4,LAURA MERCIER-Balancing Foaming Cleanser,1,1,1,1,0,0,0,0,0,1,1,0,1,1,0,0,0,0,0,0,0,0,1,1,0,0,0,0,0,0,1,1,1,1,1
139,4.4,BY TERRY-Baume De Rose Bi-Phase Make-Up Remover,1,1,1,1,1,0,0,0,0,1,1,0,0,1,0,0,0,0,0,0,0,0,0,0,0,1,0,1,0,0,1,1,1,1,1
140,3.7,LIXIRSKIN-Electrogel Cleanser,1,1,1,1,1,0,0,0,0,0,1,0,0,0,0,0,0,0,0,0,0,0,0,0,1,0,0,0,0,0,1,1,1,1,0
141,4.4,GIVENCHY-Skin Ressource Cleansing Micellar Water,1,1,1,1,0,0,0,0,0,1,0,0,0,0,0,0,0,0,0,0,0,0,0,0,0,1,0,0,0,0,1,1,1,1,1
142,4.3,LA MER-The Cleansing Micellar Water,1,1,1,1,0,0,0,0,0,1,0,0,0,1,0,0,0,0,1,0,0,0,0,0,0,1,0,0,0,0,1,1,1,1,1
143,4.5,DRUNK ELEPHANT-Pekee Bar™,1,1,1,1,1,0,0,0,0,1,0,0,1,0,0,0,0,0,0,0,1,0,0,0,0,0,0,0,0,0,1,1,1,1,1
144,3.0,BYBI BEAUTY-Milk Melt Cleanser,1,1,1,1,0,0,0,0,0,0,0,0,0,0,0,0,0,1,0,0,0,0,1,0,0,0,0,0,0,0,1,1,1,1,1
145,5.0,VOTARY-Clarifying Cleansing Oil - Rosemary And Oat,1,1,1,1,0,0,0,1,0,0,1,0,0,1,0,0,0,1,0,0,0,0,0,0,0,0,0,1,0,0,1,1,1,1,1
146,3.2,PETER THOMAS ROTH-Anti-Aging Makeup Removing Cleansing Oil,1,1,1,1,1,1,0,0,0,0,1,1,0,1,0,0,1,0,1,0,0,0,0,0,0,0,0,1,0,0,1,1,1,1,1
147,4.6,JUICE BEAUTY-Stem Cellular™ 2-In-1 Cleanser,1,1,1,0,1,0,0,0,0,1,1,1,0,0,0,0,1,1,0,0,0,0,1,0,0,0,0,0,0,0,1,1,1,1,1
148,4.0,SHISEIDO-Extra Rich Cleansing Milk,0,1,0,0,0,0,0,0,0,1,0,0,0,0,0,0,0,0,0,0,0,0,0,1,0,0,0,0,0,0,1,1,1,1,0
149,4.4,ELEMIS-Superfood Cica Calm Cleansing Foam,1,1,1,1,1,0,0,0,0,1,1,0,0,0,0,0,1,0,0,0,0,0,0,1,0,0,0,0,0,0,1,1,1,1,1
150,4.3,DRGL-Cleanser Brightening,1,1,1,1,0,1,0,0,0,0,1,0,0,0,1,0,1,1,0,0,0,0,0,0,0,1,0,0,0,0,1,1,1,1,1
151,3.8,CLINIQUE-All-in-One Cleansing Micellar Milk + Makeup Remover,1,0,0,1,0,0,0,0,0,0,0,0,0,1,0,0,0,0,0,0,0,0,0,0,0,1,0,0,0,0,1,1,1,1,1
152,4.7,DIOR-Capture Totale Super Potent Cleanser Anti-Pollution Purifying Foam,1,1,1,1,0,0,0,0,0,0,1,0,0,0,0,0,0,0,0,0,0,0,0,1,0,0,0,0,0,0,1,1,1,1,1
153,4.6,ESTÉE LAUDER-Advanced Night Micro Cleansing Balm,0,1,1,0,0,0,0,0,0,0,0,0,0,0,0,0,0,0,0,1,0,0,0,0,0,0,0,0,0,0,1,1,1,1,1
154,4.3,EVE LOM-Cleanser,1,1,1,1,0,0,0,1,0,1,1,0,0,0,0,0,0,0,0,1,0,0,0,0,0,0,0,0,0,0,1,1,1,1,1
155,4.6,ALPHA-H-Melting Moment Cleansing Balm with Wild Orange Leaf Extract,1,1,1,1,1,0,0,0,0,0,1,0,0,1,0,0,0,0,0,1,0,0,0,0,0,0,0,0,0,0,1,1,1,1,1
156,5.0,TALIKA-Skintelligence Hydra - Moisturising Foaming Cleanser,1,1,1,1,0,0,0,0,0,1,1,0,0,0,0,0,1,0,1,0,0,0,1,0,0,0,0,0,0,0,1,1,1,1,1
157,4.5,SEPHORA COLLECTION-Cleansing & Soothing Micellar Gel,1,1,1,1,0,0,0,0,0,1,0,0,0,0,0,0,0,0,0,0,0,0,0,0,1,1,0,0,0,0,1,1,1,1,1
158,5.0,SKIN INC-Pure Serum Infused O2 Cleanser,1,1,1,1,1,0,0,0,0,1,1,0,0,1,0,0,1,0,1,0,0,0,1,1,1,0,0,0,0,0,1,1,1,1,1
159,4.3,MARIO BADESCU-Gentle Foaming Cleanser,1,1,1,1,0,0,0,0,0,1,1,0,0,0,0,0,0,0,0,0,0,0,1,0,0,0,0,0,0,0,1,1,1,1,1
160,3.6,ALPHA-H-Everyday Fresh Cotton Cloths,1,1,1,1,1,0,0,0,0,0,1,0,0,0,0,0,0,0,0,0,0,0,0,0,0,0,0,0,0,1,1,1,1,1,1
161,4.0,PIXI-Double Cleanse,1,1,1,1,0,0,0,0,0,0,0,0,0,1,0,0,0,0,0,0,0,0,1,0,0,0,0,1,0,0,1,1,1,1,1
162,4.3,SKIN INC-Pure Prodew Cleansing Foam,1,1,1,0,1,0,0,0,0,0,1,0,0,0,0,0,0,0,0,0,0,0,0,1,0,0,0,0,0,0,1,1,1,1,1
163,4.2,PIXI-Glow Mud Cleanser,1,1,1,1,0,0,0,0,0,0,1,0,0,0,0,0,0,0,1,0,0,0,1,0,0,0,0,0,0,0,1,1,1,1,1
164,4.4,GLO SKIN BEAUTY-Hydra-Bright AHA Cleanser,1,1,1,1,0,0,0,0,0,1,1,0,0,1,0,0,1,0,0,0,0,0,0,1,1,0,0,0,0,0,1,1,1,1,1
165,3.7,CLINIQUE-All About Clean™ Liquid Facial Soap (Extra Mild),1,0,1,0,1,0,0,0,0,1,0,0,0,0,0,0,0,0,0,0,0,0,0,0,0,1,0,0,0,0,1,1,1,1,1
166,4.4,SATURDAY SKIN-Melt+ Cleanse Makeup Melting Balm,1,1,1,1,0,0,0,0,0,1,1,0,0,0,0,0,1,0,1,1,0,0,0,0,0,0,0,1,0,0,1,1,1,1,1
167,4.4,PETER THOMAS ROTH-Pre-Treatment Exfoliating Cleanser,1,1,1,1,0,1,0,0,0,1,0,1,0,0,0,0,1,1,0,0,0,0,0,0,0,1,0,0,0,0,1,1,1,1,1
168,4.4,FRESH-Cleanse & Treat Trio (Christmas Limited Edition),1,1,1,1,0,0,0,0,0,1,1,0,1,0,0,0,1,0,0,0,0,0,1,0,1,1,0,0,0,0,1,1,1,1,1
169,4.4,BY TERRY-Cellularose Micellar Water Cleanser,1,1,1,1,1,0,0,0,0,0,1,0,0,0,0,0,0,1,0,0,0,0,0,0,0,1,0,0,0,0,1,1,1,1,1
170,4.3,VOTARY-Cleansing Oil - Rose Geranium And Apricot,1,1,1,1,1,0,0,0,0,0,1,0,0,0,0,0,0,1,0,0,0,0,0,0,0,0,0,1,0,0,1,1,1,1,1
171,4.4,SATURDAY SKIN-Rise + Shine Gentle Cleanser,1,1,1,1,0,0,0,0,0,1,0,0,0,0,0,0,0,0,0,0,0,0,1,0,0,0,0,0,0,0,1,1,1,1,0
172,4.4,EVE LOM-Foaming Cream Cleanser,1,1,1,1,0,0,0,0,0,1,1,0,0,0,0,0,0,0,0,0,0,0,1,1,0,0,0,0,0,0,1,1,1,1,1
173,4.4,GIVENCHY-Skin Ressource Liquid Cleansing Balm,1,1,1,1,0,0,0,0,0,0,0,0,0,0,0,0,1,0,1,1,0,0,0,0,0,1,0,0,0,0,1,1,1,1,1
174,4.4,MAC COSMETICS-Lightful C³ Clarifying Gel-To-Foam Deep Cleanser,1,1,1,1,0,0,0,0,0,1,1,0,0,0,0,0,0,0,0,0,0,0,0,0,1,0,0,0,0,0,1,1,1,1,1
175,4.5,ESTÉE LAUDER-Perfectly Clean Multi-Action Cleansing Gelee/Refiner 150ml,1,1,1,1,0,0,0,0,0,0,0,0,0,1,0,0,0,0,1,0,0,0,0,0,1,0,0,0,0,0,1,1,1,1,1
176,4.3,LA MER-The Cleansing Gel,1,1,1,1,0,0,0,0,0,0,1,0,0,1,0,0,0,0,0,0,0,0,0,1,1,0,0,0,0,0,1,1,1,1,1
177,4.3,FIRST AID BEAUTY-Pure Skin Deep Cleanser With Red Clay,1,1,1,1,1,0,0,1,0,0,1,0,0,1,0,0,1,0,0,0,0,0,0,0,1,0,0,0,0,0,1,1,1,1,1
178,5.0,MALIN + GOETZ-Facial Cleansing Oil,1,1,1,1,1,0,0,0,0,1,0,0,0,0,0,0,0,0,0,0,0,0,0,0,0,0,0,1,0,0,1,1,1,1,1
179,4.3,VOTARY-Cleansing Oil - Rose Geranium And Apricot,1,1,1,1,1,0,0,0,0,0,1,0,0,0,0,0,0,1,0,0,0,0,0,0,0,0,0,1,0,0,1,1,1,1,1
180,4.4,SATURDAY SKIN-Rise + Shine Gentle Cleanser,1,1,1,1,0,0,0,0,0,1,0,0,0,0,0,0,0,0,0,0,0,0,1,0,0,0,0,0,0,0,1,1,1,1,0
181,4.4,EVE LOM-Foaming Cream Cleanser,1,1,1,1,0,0,0,0,0,1,1,0,0,0,0,0,0,0,0,0,0,0,1,1,0,0,0,0,0,0,1,1,1,1,1
182,4.4,GIVENCHY-Skin Ressource Liquid Cleansing Balm,1,1,1,1,0,0,0,0,0,0,0,0,0,0,0,0,1,0,1,1,0,0,0,0,0,1,0,0,0,0,1,1,1,1,1
183,4.4,MAC COSMETICS-Lightful C³ Clarifying Gel-To-Foam Deep Cleanser,1,1,1,1,0,0,0,0,0,1,1,0,0,0,0,0,0,0,0,0,0,0,0,0,1,0,0,0,0,0,1,1,1,1,1
184,4.3,LA MER-The Cleansing Gel,1,1,1,1,0,0,0,0,0,0,1,0,0,1,0,0,0,0,0,0,0,0,0,1,1,0,0,0,0,0,1,1,1,1,1
185,4.5,ESTÉE LAUDER-Perfectly Clean Multi-Action Cleansing Gelee/Refiner 150ml,1,1,1,1,0,0,0,0,0,0,0,0,0,1,0,0,0,0,1,0,0,0,0,0,1,0,0,0,0,0,1,1,1,1,1
186,5.0,DIOR-Prestige La Mousse Micellaire Face Cleanser,1,1,1,1,0,0,0,0,0,0,1,0,0,0,0,0,0,0,0,0,0,0,1,1,0,0,0,0,0,0,1,1,1,1,1
187,4.4,FOREO-Micro-Foam Cleanser,1,1,1,1,0,0,0,0,0,1,0,0,0,1,0,0,0,0,1,0,0,0,1,1,0,0,0,0,0,0,1,1,1,1,1
188,3.0,DRGL-Cleanser Acne,1,1,1,1,1,0,1,1,0,0,0,0,0,1,0,0,0,0,0,0,0,0,0,0,0,1,0,0,0,0,1,1,1,1,1
189,4.0,GLAMGLOW-Supercleanse™ Clearing Cream-to-Foam Cleanser,1,1,1,1,0,0,0,0,0,0,0,0,0,1,0,0,1,1,1,0,0,0,1,1,0,0,0,0,0,0,1,1,1,1,1
190,4.4,DRGL-Cleanser Clarifying,1,1,1,1,0,0,0,1,0,0,0,0,0,0,0,0,0,0,0,0,0,0,0,0,0,1,0,0,0,0,1,1,1,1,1
191,3.7,JUICE BEAUTY-Green Apple Brightening Gel Cleanser,1,1,1,1,0,0,0,0,0,1,1,0,0,0,0,0,0,0,0,0,0,0,0,0,1,0,0,0,0,0,1,1,1,1,1
192,4.5,PETER THOMAS ROTH-Water Drench Hyaluronic Cloud Makeup Removing Gel Cleanser,1,1,1,1,0,0,0,0,0,1,1,0,0,1,0,0,1,0,0,0,0,0,0,0,1,0,0,0,0,0,1,1,1,1,1
193,4.3,FIRST AID BEAUTY-Pure Skin Deep Cleanser With Red Clay,1,1,1,1,1,0,0,1,0,0,1,0,0,1,0,0,1,0,0,0,0,0,0,0,1,0,0,0,0,0,1,1,1,1,1
194,4.4,GUERLAIN-Abeille Royale Cleansing Oil,1,1,1,1,0,0,0,0,0,1,1,0,0,0,0,0,0,0,0,0,0,0,0,0,0,0,0,1,0,0,1,1,1,1,1
195,4.4,INNISFREE-Green Tea Hydrating Amino Acid Cleansing Water,1,1,1,1,0,0,0,0,0,1,0,0,0,0,0,0,1,0,0,0,0,0,0,0,0,1,0,0,0,0,1,1,1,1,1
196,4.5,DERMALOGICA-Ultracalming™ Cleanser,0,0,0,0,1,0,0,0,0,0,0,0,0,0,0,0,0,1,0,0,0,0,1,0,1,0,0,0,0,0,1,1,1,1,1
197,4.5,DERMALOGICA-Active Clay Cleanser,1,1,1,1,0,0,0,0,0,0,1,0,0,1,0,0,1,0,0,0,0,0,1,0,0,0,0,0,0,0,1,1,1,1,1
198,4.4,LANEIGE-Water Bank Blue Hyaluronic Cleansing Gel,1,1,1,1,1,0,0,0,0,1,1,0,0,0,0,0,0,0,0,0,0,0,0,0,1,0,0,0,0,0,1,1,1,1,1
199,4.4,BY TERRY-Baume De Rose Micellar Water,1,1,1,1,1,0,0,0,0,1,1,0,0,1,0,0,0,0,0,0,0,0,0,0,0,1,0,0,0,0,1,1,1,1,1
200,5.0,HANZ DE FUKO-Gentle Face Wash,1,1,1,1,1,0,0,0,0,1,1,0,0,1,0,0,0,0,0,0,0,0,0,0,0,1,0,0,0,0,1,1,1,1,1
201,3.0,DOERS OF LONDON-Facial Cleanser,1,1,1,1,1,0,0,0,0,0,1,0,0,1,0,0,0,0,1,0,0,0,0,0,0,0,1,0,0,0,1,1,1,1,1
202,4.8,THREE-Balancing Foam R,1,0,1,1,0,0,0,0,0,0,0,0,1,0,0,0,1,0,0,0,0,0,0,1,0,0,0,0,0,0,1,1,1,1,1
203,4.8,DRGL-Cleanser Oil Control,0,0,0,1,0,0,0,0,0,0,0,0,0,1,0,0,0,0,0,0,0,0,0,0,0,0,0,1,0,0,1,1,1,1,1
204,4.8,BYBI BEAUTY-Swipe Clean Facial Cleansing Oil and Makeup Remover,1,1,1,1,1,0,0,0,0,1,0,0,0,0,0,0,0,0,0,0,0,0,1,0,0,0,0,0,0,0,1,1,1,1,0
205,4.0,GLAMGLOW-Gentlebubble™ Daily Conditioning Cleanser,1,1,1,1,1,0,0,0,0,0,1,0,0,0,0,0,0,0,0,0,0,0,0,1,0,0,0,0,0,0,1,1,1,1,1
206,4.0,ELEMIS-Dynamic Resurfacing Facial Wash,1,1,1,1,0,0,0,0,0,1,1,0,0,0,0,0,1,0,0,0,0,0,0,0,1,0,0,0,0,0,1,1,1,1,1
207,4.2,CLE DE PEAU-Softening Cleansing Foam,1,1,1,1,0,0,0,0,0,1,1,0,0,0,0,0,0,0,0,0,0,0,0,1,0,0,0,0,0,0,1,1,1,1,1
208,4.1,JUICE BEAUTY-Blemish Clearing Cleanser,1,1,1,1,0,0,0,1,0,1,0,0,0,0,0,0,0,0,0,0,0,0,1,0,0,0,0,0,0,0,1,1,1,1,1
209,3.6,INDIE LEE-Soothing Cleanser,1,1,1,1,1,0,0,0,0,1,0,1,0,0,0,0,1,1,0,0,0,0,0,0,0,1,0,0,0,0,1,1,1,1,1
210,4.0,DRGL-Cleanser Lightening Plus,1,1,1,1,1,0,0,0,0,0,1,0,0,0,1,0,0,1,0,0,0,0,0,0,0,1,0,0,0,0,1,1,1,1,1
