unique_id,rating,Combination,Dry,Normal,Oily,Sensitive,Ageing,Blackheads,Blemishes,DarkCircles,Dryness,Dullness,FineLines&Wrinkles,Firmness&Elasticity,Oiliness,Pigmentation&DarkSpots,Puffiness,UnevenSkinTexture,UnevenSkinTone,VisiblePores,Balm,Cream,Gel,Liquid,Lotion,Oil,Spray,20s,30s,40s,50+,Under20
THE ORDINARY-Natural Moisturizing Factors + HA,4.2,1,1,1,1,0,0,0,0,0,1,1,0,0,0,0,0,0,0,0,0,1,0,0,0,0,0,1,1,1,1,1
OLE HENRIKSEN-Strength Trainer Peptide Boost Moisturizer,4.5,1,1,1,1,1,0,0,0,0,1,0,1,1,0,0,0,0,0,0,0,1,0,0,0,0,0,1,1,1,1,1
FRESH-Rose Deep Hydration Face Cream Moisturizer,4.6,1,1,1,1,0,0,0,0,0,1,1,0,0,0,0,0,0,0,0,0,1,0,0,0,0,0,1,1,1,1,1
OLE HENRIKSEN-Cold Plunge™ Pore Remedy Moisturizer,4.4,1,1,1,1,0,0,0,0,0,1,0,1,0,1,1,0,1,0,1,0,1,0,0,0,0,0,1,1,1,1,1
BOBBI BROWN-Vitamin Enriched Face Base - Moisturizer and Primer,4.5,1,1,1,1,1,0,0,0,0,1,1,0,1,0,0,0,0,0,0,0,0,0,0,1,0,0,1,1,1,1,1
OLE HENRIKSEN-Hunt For Hydration Mini Moisturizer & Eye Crème Duo (Christmas Limited Edition),5.0,1,1,1,1,1,0,0,0,0,1,1,1,0,0,0,0,0,0,0,0,1,0,0,0,0,0,1,1,1,1,1
FIRST AID BEAUTY-Ultra Repair Cream,4.5,1,1,1,0,1,0,0,0,0,1,0,0,0,0,0,0,0,0,0,0,1,0,0,0,0,0,1,1,1,1,1
TATCHA-Dewy Cleanse And Hydrate Duo (Christmas Limited Edition),4.3,1,1,1,1,0,0,0,0,0,1,0,0,0,0,0,0,0,0,0,0,1,0,1,0,0,0,1,1,1,1,1
GLOW RECIPE-Watermelon Glow Pink Juice Moisturizer,4.0,1,1,1,1,0,0,0,0,0,1,1,0,0,1,0,0,0,1,1,0,0,1,0,0,0,0,1,1,1,1,1
GLOW RECIPE-Plum Plump Hyaluronic Cream,4.5,1,1,1,1,1,0,0,0,0,1,1,0,0,0,0,0,1,0,0,0,1,1,0,0,0,0,1,1,1,1,1
TATCHA-Clarifying Cleanse And Hydrate Duo (Christmas Limited Edition),4.3,1,1,1,1,0,0,0,0,0,1,0,0,0,1,0,0,1,0,1,0,1,0,0,1,0,0,1,1,1,1,1
FRESH-Best Of Beauty Bundle (Christmas Limited Edition),4.8,1,1,1,1,0,0,0,0,0,1,1,0,0,0,0,0,0,0,1,0,1,0,1,0,0,0,1,1,1,1,1
ESTÉE LAUDER-Revitalizing Supreme+ Youth Power Soft Creme Moisturizer,5.0,1,1,1,1,0,1,0,0,0,1,0,1,1,0,0,0,1,1,0,0,1,0,0,0,0,0,1,1,1,1,1
CLINIQUE-Dramatically Different Moisturizing Gel,4.5,1,0,0,1,1,0,0,0,0,1,0,0,0,1,0,0,0,0,0,0,0,1,0,0,0,0,1,1,1,1,1
FRESH-Best Selling Duo (Christmas Limited Edition),4.3,1,1,1,1,0,0,0,0,0,1,0,0,0,0,0,0,0,0,0,0,1,1,0,0,0,0,1,1,1,1,1
CLINIQUE-Moisture Surge 100H Auto-Replenishing Hydrator Moisturiser,4.3,1,1,1,1,0,0,0,0,0,1,1,0,1,0,0,0,1,0,0,0,1,1,0,0,0,0,1,1,1,1,1
SK-II-Skinpower Airy Milky Lotion,4.2,1,1,1,1,0,1,0,0,0,1,1,0,1,0,0,0,1,1,0,0,1,0,0,0,0,0,1,1,1,1,1
TATCHA-The Dewy Skin Cream,4.2,0,1,1,0,0,0,0,0,0,1,1,0,1,0,0,0,1,0,0,0,1,0,0,0,0,0,1,1,1,1,1
SK-II-Skinpower Cream,4.1,1,1,1,1,0,1,0,0,0,1,1,0,1,0,0,0,1,1,0,0,1,0,0,0,0,0,1,1,1,1,1
FENTY SKIN-Instant Reset Overnight Recovery Gel-Cream,4.3,1,1,1,1,1,0,0,0,0,1,1,1,1,1,1,0,1,1,1,0,1,1,0,0,0,0,1,1,1,1,1
"THE INKEY LIST-Vitamin B, C And E Moisturizer",4.2,1,1,1,1,0,0,0,0,0,1,1,0,0,1,0,0,1,0,0,0,1,0,0,0,0,0,1,1,1,1,1
FENTY SKIN-Hydra Vizor Invisible Broad Spectrum SPF 30 Sunscreen Moisturizer,4.4,1,1,1,1,0,0,0,0,0,1,1,1,0,0,1,0,1,1,1,0,1,0,0,0,0,0,1,1,1,1,1
LANCÔME-UV Expert Youth-Shield™ Aqua Gel SPF50 PA++++,4.3,1,1,1,1,1,1,0,1,0,0,0,0,0,1,1,0,0,0,0,0,0,1,0,0,0,0,1,1,1,1,0
SUPERGOOP!-Every Single Face SPR-Shield watery lotion SPF 50,4.7,1,1,1,1,0,0,0,0,0,0,1,0,0,0,1,0,1,1,0,0,0,0,0,1,0,0,1,1,1,1,1
ORIGINS-Mega-Mushroom Magic Ultimate Skin Relief Collection (Christmas Limited Edition),5.0,1,1,1,1,1,0,0,0,0,1,0,0,0,0,0,0,1,0,0,0,0,0,1,1,0,0,1,1,1,1,1
LANCÔME-Hydra Zen Anti-Stress Moisturising Cream-Gel,4.6,0,1,0,0,0,0,0,0,0,1,0,0,0,0,0,0,0,0,0,0,0,1,0,0,0,0,1,1,0,0,0
THE INKEY LIST-Bakuchiol Moisturizer,4.1,1,1,1,1,1,0,0,0,0,1,0,0,1,0,0,0,0,0,0,0,1,0,0,0,0,0,1,1,1,1,0
FRESH-Lotus Youth Preserve Moisturizer With Multi-Action Super Lotus,4.4,1,1,1,1,0,1,0,0,0,1,1,1,0,0,0,0,0,0,0,0,1,0,0,0,0,0,1,1,1,1,0
EGYPTIAN MAGIC-Egyptian Magic Cream,4.2,1,1,1,1,1,0,0,0,0,1,0,0,0,0,0,0,0,0,0,0,1,0,0,0,0,0,1,1,1,1,1
OLE HENRIKSEN-C-Rush Brightening Gel Crème,4.4,1,1,1,1,0,1,0,0,0,1,1,1,0,0,0,0,1,0,0,0,1,1,0,0,0,0,1,1,1,1,1
DRUNK ELEPHANT-All Protinis Great and Small (Limited Edition),4.3,1,1,1,1,0,0,0,0,0,1,0,1,1,0,0,0,1,1,0,0,1,0,0,0,0,0,1,1,1,1,1
DR.JART+-Cicapair Cream,4.6,1,1,1,1,1,0,0,0,0,1,0,0,0,0,0,0,1,0,0,0,1,0,0,0,0,0,1,1,1,1,1
THE INKEY LIST-Peptide Moisturizer,4.0,1,1,1,1,0,0,0,0,0,1,0,1,1,0,0,0,0,0,0,0,1,0,0,0,0,0,1,1,1,1,1
BIOSSANCE-Squalane + Probiotic Gel Moisturizer,4.1,1,1,1,1,0,0,0,0,0,1,1,0,0,0,0,0,0,0,0,0,0,1,0,0,0,0,1,1,1,1,1
CAUDALIE-Vinosource-Hydra Grape Water Gel Moisturizer,4.3,1,1,1,1,1,0,0,0,0,1,0,0,0,0,0,0,0,0,0,0,0,1,0,0,0,0,1,1,1,1,1
DRUNK ELEPHANT-Protini™ Polypeptide Cream Mini,4.6,1,1,1,1,0,1,0,0,0,1,1,1,0,0,0,0,1,1,0,0,1,0,0,0,0,0,1,1,1,1,1
GLOW RECIPE-Plum Plump Hyaluronic Cream Refill Pod,5.0,1,1,1,1,0,0,0,0,0,1,1,0,0,0,0,0,1,0,0,0,1,1,0,0,0,0,1,1,1,1,1
PHILOSOPHY-Hope In A Jar Smooth-Glow Multi-Tasking Moisturizer,4.7,1,1,1,1,1,1,0,0,0,1,1,1,0,0,0,0,1,0,0,0,1,0,0,0,0,0,1,1,1,1,0
FENTY SKIN-Hydra Vizor Invisible Broad Spectrum SPF 30 Sunscreen Moisturizer Refill,4.6,1,1,1,1,0,0,0,0,0,1,1,1,0,0,1,0,1,1,1,0,1,0,0,0,0,0,1,1,1,1,1
CAUDALIE-Resveratrol-Lift Firming Cashmere Cream,4.7,1,1,1,1,0,0,0,0,0,1,0,1,1,0,0,0,1,0,0,0,1,0,0,0,0,0,1,1,1,1,1
THE INKEY LIST-Vitamin C Serum,3.2,1,1,1,1,1,0,0,0,0,0,1,1,0,0,0,0,0,1,0,0,1,0,0,0,0,0,1,1,1,1,0
ORIGINS-Original Skin™ Matte Moisturizer with Willowherb,4.4,1,1,1,1,0,0,0,0,0,0,1,0,0,1,0,0,1,0,1,0,1,0,0,0,0,0,1,1,1,1,1
INNISFREE-Jeju Cherry Blossom Jelly Cream,4.6,1,1,1,1,0,0,0,0,0,1,1,0,0,0,0,0,0,0,0,0,1,1,0,0,0,0,1,1,1,1,1
BIOSSANCE-Squalane + Omega Repair Cream,4.5,1,1,1,1,0,0,0,0,0,1,1,1,1,0,0,0,0,0,0,0,1,0,0,0,0,0,1,1,1,1,0
DR. DENNIS GROSS-Advanced Retinol + Ferulic Intense Wrinkle Cream,4.8,1,1,1,1,0,1,0,0,0,1,0,1,1,0,0,0,1,0,0,0,1,0,0,0,0,0,1,1,1,1,1
FRESH-Rose Deep Hydration Essentials (Christmas Limited Edition),4.5,1,1,1,1,0,0,0,0,0,1,1,0,0,0,0,0,1,0,1,0,1,0,1,0,0,0,1,1,1,1,1
SHISEIDO-Energizing Moisturizer Extra Light Fluid,4.3,1,1,1,1,0,0,0,0,0,1,1,1,0,0,0,0,0,0,0,0,1,0,0,0,0,0,1,1,1,1,1
ORIGINS-Ginzing™ Energizing Gel Cream,4.3,1,1,1,1,0,0,0,0,0,1,1,0,0,0,0,0,0,1,1,0,1,1,0,0,0,0,1,1,1,1,1
DRUNK ELEPHANT-A-Passioni™ Retinol Skincare Cream,4.1,1,1,1,1,0,1,0,0,0,1,0,1,1,0,0,0,1,1,0,0,1,0,0,0,0,0,1,1,1,1,1
IT COSMETICS-Confidence in a Cream™ Transforming Moisturizing Super Cream,4.5,1,1,1,1,1,1,0,0,0,1,0,1,1,0,0,0,1,0,0,0,1,0,0,0,0,0,1,1,1,1,1
CHARLOTTE TILBURY-Refillable Magic Cream SPF,4.2,1,1,1,1,0,1,0,0,0,1,1,1,0,0,0,0,0,0,0,0,1,0,0,0,0,0,1,1,1,1,1
FIRST AID BEAUTY-Ultra Repair Firming Collagen Cream,4.5,1,1,1,1,1,1,0,0,0,1,0,1,1,0,0,0,1,0,0,0,1,0,0,0,0,0,1,1,1,1,1
CHARLOTTE TILBURY-Charlotte's Magic Cream,4.5,1,1,1,1,0,0,0,0,0,1,1,0,0,0,0,0,1,0,0,0,1,0,0,0,0,0,1,1,1,1,1
SUPERGOOP!-Superscreen Daily Moisturizer SPF 40 PA+++,3.7,1,1,1,1,1,0,0,0,0,1,0,0,0,0,0,0,0,0,0,0,1,0,0,0,0,0,1,1,1,1,0
KORA ORGANICS BY MIRANDA KERR-Turmeric Glow Moisturizer,4.5,1,1,1,1,1,1,0,0,0,0,1,1,0,0,1,0,1,0,0,0,1,0,0,0,0,0,1,1,1,1,0
SEPHORA COLLECTION-Nourishing Moisturizer Cream,4.6,1,1,1,1,0,0,0,0,0,1,0,0,0,0,0,0,0,0,0,0,1,0,0,0,0,0,1,1,1,1,1
SUNDAY RILEY-C.E.O. Vitamin C Rich Hydration Cream,4.4,1,1,1,1,0,1,0,0,0,1,1,0,0,0,1,0,1,0,0,0,1,0,0,0,0,0,1,1,1,1,1
GLAMGLOW-Glowstarter Mega Illuminating Moisturizer,4.1,1,1,1,1,0,0,0,0,0,1,1,0,0,0,0,0,0,0,0,0,1,0,0,0,0,0,1,1,1,1,1
SHISEIDO-White Lucent Brightening Gel Cream,3.5,1,1,1,1,0,0,0,0,0,1,1,0,0,0,1,0,1,0,0,0,1,0,0,0,0,0,1,1,1,1,1
DR.JART+-Ceramidin Cream,4.5,1,1,1,1,0,0,0,0,0,1,0,0,0,0,0,0,0,0,0,0,1,0,0,0,0,0,1,1,1,1,1
DRUNK ELEPHANT-Lala Retro™ Whipped Cream,4.2,1,1,1,1,1,0,0,0,0,1,1,1,0,0,0,0,0,0,0,0,1,0,0,0,0,0,1,1,1,1,1
LAB SERIES-Oil Control Moisturizer,4.3,1,1,1,1,0,0,0,1,0,1,1,0,0,1,0,0,0,1,1,0,1,0,0,0,0,0,1,1,1,1,1
DR. DENNIS GROSS-VitaminC Lactic Dewy Deep Cream,4.8,1,1,1,1,0,1,0,0,0,1,1,1,1,0,0,0,0,0,0,0,1,0,0,0,0,0,1,1,1,1,1
SEPHORA COLLECTION-Matte Moisturizer,4.6,1,0,1,1,0,0,0,0,0,1,0,0,0,1,0,0,0,0,0,0,1,0,0,0,0,0,1,1,1,1,1
SEPHORA COLLECTION-All Day Hydrator,4.6,1,1,1,1,0,1,0,0,0,1,1,0,0,0,0,0,0,0,0,0,1,0,0,0,0,0,1,1,1,1,1
SUNDAY RILEY-Morning Buzz Trio (Christmas Limited Edition),5.0,1,1,1,1,1,1,0,0,0,1,1,0,1,0,1,0,1,1,0,0,1,0,1,0,1,0,1,1,1,1,1
IT COSMETICS-Confidence In A Gel Lotion,4.6,1,1,1,1,1,1,0,0,0,1,1,1,0,0,0,0,1,0,0,0,0,1,0,1,0,0,1,1,1,1,1
SHISEIDO-Benefiance Wrinkle Smoothing Day Emulsion,5.0,1,1,1,1,0,1,0,0,0,1,0,1,1,0,0,0,0,0,0,0,1,0,0,0,0,0,1,1,1,1,1
TARTE-Knockout Brightening Gel Moisturizer,4.2,1,1,1,1,0,1,0,0,0,0,1,0,0,0,0,0,0,0,1,0,0,1,0,0,0,0,1,1,1,1,1
DRUNK ELEPHANT-Welcome to Lala Land (Limited Edition),4.3,1,1,1,1,0,0,0,0,0,1,0,0,0,0,0,0,0,0,0,0,1,0,0,0,0,0,1,1,1,1,1
CLINIQUE-Anti-Blemish All Over Clearing Treatment,3.9,0,0,0,1,0,0,0,1,0,1,0,0,0,0,0,0,0,0,0,0,1,0,0,0,0,0,1,1,1,1,1
SULWHASOO-Essential Comfort Moisturizing Gel Cream,4.3,1,1,1,1,0,0,0,0,0,1,1,0,0,0,0,0,1,0,0,0,1,1,0,0,0,0,1,1,1,1,1
INNISFREE-Jeju Cherry Blossom Tone Up Cream,3.7,1,1,1,1,0,0,0,0,0,0,1,0,0,0,0,0,0,1,0,0,1,0,0,0,0,0,1,1,1,1,1
ORIGINS-Clear Improvement™ Oil-Free Moisturizer with Bamboo Charcoal,4.3,1,1,1,1,1,0,0,1,0,1,0,0,0,1,0,0,0,0,1,0,1,0,0,0,0,0,1,1,1,1,1
LANEIGE-Water Bank Blue Hyaluronic Cream - For Normal To Dry Skin,4.7,1,1,1,1,1,0,0,0,0,1,0,0,0,0,0,0,0,0,0,0,1,0,0,0,0,0,1,1,1,1,1
EVEREDEN-Nourishing Stretch Mark Cream,4.5,1,1,1,1,1,0,0,0,0,1,0,0,1,0,0,0,1,0,0,0,1,0,0,0,0,0,1,1,1,1,1
DR.JART+-Vital Hydra Solution Biome Water Cream,4.1,1,1,1,1,1,0,0,0,0,1,0,0,0,0,0,0,0,0,0,0,1,1,0,0,0,0,1,1,1,1,1
BOBBI BROWN-Vitamin Enriched Eye Base - Eye Cream And Primer,4.7,1,1,1,1,0,0,0,0,0,1,0,1,0,0,0,0,1,0,0,0,1,0,0,0,0,0,1,1,1,1,1
TATCHA-The Silk Peony Melting Eye Cream,4.2,1,1,1,1,1,1,0,0,0,1,1,1,0,0,0,0,0,0,0,1,1,0,0,0,0,0,1,1,1,1,1
CAUDALIE-Vinosource-Hydra S.O.S Intense Moisturizing Cream,4.3,1,1,1,1,1,0,0,0,0,1,0,0,0,0,0,0,0,1,0,0,1,0,0,0,0,0,1,1,1,1,1
FARMACY-Honey Halo Ultra-Hydrating Ceramide Moisturizer,4.5,0,1,1,0,0,0,0,0,0,1,1,1,1,0,0,0,1,0,0,0,1,0,0,0,0,0,1,1,1,1,1
ALPHA-H-Balancing Moisturiser & Gentle Exfoliant with 10% Glycolic Acid,3.8,1,0,1,1,0,1,0,0,0,1,0,1,0,1,1,0,0,0,0,0,1,0,0,0,0,0,1,1,1,1,1
BY TERRY-Hyaluronic Global Face Cream,5.0,1,1,1,1,0,0,0,1,0,1,1,1,0,0,1,0,1,1,0,0,1,0,0,0,0,0,1,1,1,1,1
CLE DE PEAU-Protective Fortifying Cream,3.0,1,1,1,1,0,0,0,0,0,1,1,0,1,0,0,0,0,0,0,0,1,0,0,0,0,0,1,1,1,1,1
LAB SERIES-Instant Fix Color Correcting Moisturizer,5.0,1,1,1,1,0,0,0,0,0,1,1,1,0,0,0,0,1,1,1,0,1,0,0,0,0,0,1,1,1,1,1
PHILOSOPHY-Purity Made Simple Mattifying Gel Moisturizer,4.1,1,1,1,1,0,0,0,0,0,1,0,0,0,0,0,0,0,0,0,0,0,1,0,0,0,0,1,1,1,1,1
GIVENCHY-Skin Ressource Protective Moisturising Rich Cream Refill,4.3,1,1,1,0,0,0,0,0,0,1,1,0,0,0,0,0,1,0,0,0,1,0,0,0,0,0,1,1,1,1,1
GLAMGLOW-Superwatergel Triple-Acid Oil-Free Moisturizer,4.6,1,1,1,1,0,0,0,1,0,1,1,0,0,0,0,0,0,0,1,0,0,1,1,0,0,0,1,1,1,1,1
THE INKEY LIST-Symbright Brightening Moisturiser,3.8,1,1,1,1,0,0,0,0,0,1,1,0,0,0,1,0,1,1,0,0,1,0,0,0,0,0,1,1,1,1,1
DIOR-Capture Totale DreamSkin Care & Perfect Emulsion,4.4,1,1,1,1,1,0,0,0,0,1,1,0,0,0,1,0,1,0,1,0,0,0,1,0,0,0,1,1,1,1,0
LANEIGE-Water Bank Blue Hyaluronic Emulsion - For Normal To Dry Skin,4.3,1,1,1,1,1,0,0,0,0,1,1,0,0,0,0,0,0,0,0,0,0,0,0,1,0,0,1,1,1,1,1
INDIE LEE-Brightening Cream,4.3,1,1,1,1,1,0,0,0,0,1,1,0,0,0,0,0,1,1,0,0,1,0,0,0,0,0,1,1,1,1,1
CLINIQUE-Dramatically Different Moisturizing Lotion+ With Pink Ribbon Key Chain,4.3,1,1,1,1,0,0,0,0,0,1,1,0,0,0,0,0,0,0,0,0,0,0,0,1,0,0,1,1,1,1,1
WISHFUL-Honey Whip Peptide Moisturizer,4.6,1,1,1,1,0,0,0,0,0,1,0,0,1,0,0,0,0,0,0,0,1,0,0,0,0,0,1,1,1,1,1
ALPHA-H-Essential Hydration Cream with Rose Geranium and Vitamin E,4.2,1,1,1,1,1,0,0,0,0,1,0,0,0,0,0,0,0,0,0,0,1,0,0,0,0,0,1,1,1,1,0
BURT'S BEES-Sensitive Day Cream,2.5,1,1,1,1,1,0,0,0,0,1,0,0,0,0,0,0,0,0,0,0,1,0,0,0,0,0,1,1,1,1,1
KOPARI-Coconut Face Cream,4.3,1,1,1,1,1,0,0,0,0,1,1,0,0,0,0,0,0,0,0,0,1,0,0,1,0,0,1,1,1,1,0
IT COSMETICS-Beautiful Together Day-To-Night Skincare Duo (Christmas Limited Edition),4.3,1,1,1,1,0,1,0,0,0,1,1,1,1,0,0,0,1,0,0,0,1,0,0,0,0,0,1,1,1,1,1
LA MER-Crème De La Mer Moisturizer (Limited Edition),4.3,1,1,1,1,0,1,0,0,0,1,0,1,1,0,0,0,1,0,0,0,1,0,0,0,0,0,1,1,1,1,1
FRESH-Black Tea Firming Corset Cream,4.1,1,1,1,1,1,1,0,0,0,1,0,1,1,0,0,0,0,0,0,0,1,0,0,0,0,0,0,1,1,1,0
CAUDALIE-Vinosource-Hydra Moisturizing Sorbet,4.7,1,1,1,1,1,0,0,0,0,1,0,0,0,0,0,0,0,1,0,0,0,1,0,0,0,0,1,1,1,1,1
DR. DENNIS GROSS-B3Adaptive Superfoods Barrier Repair Face Cream,3.5,1,1,1,1,0,1,0,0,0,1,1,0,1,0,0,0,1,0,0,0,1,0,0,0,0,0,1,1,1,1,1
KENZOKI-Nourishing Flow Sensual Body Cream,5.0,1,1,1,1,0,0,0,0,0,1,1,0,0,0,0,0,0,0,0,0,1,0,0,0,0,0,1,1,1,1,1
CAUDALIE-Skincare Bestie Box,3.5,1,1,1,1,0,0,1,1,0,1,1,0,0,1,1,0,0,0,1,0,1,1,1,0,0,0,1,1,1,1,1
TARTE-Sea Drink Of H₂O Hydrating Boost Moisturizer,4.2,1,1,1,1,1,0,0,0,0,1,0,0,0,0,0,0,0,0,0,0,1,1,0,0,0,0,1,1,1,1,1
CAUDALIE-Resveratrol-Lift Lightweight Firming Cashmere Cream,4.6,1,1,1,1,0,0,0,0,0,1,0,1,1,0,0,0,1,0,0,0,1,0,0,0,0,0,1,1,1,1,1
TALIKA-Skintelligence Hydra - Intense Hydrating Light Cream,4.3,1,1,1,1,0,0,0,0,0,1,1,0,0,0,0,0,1,0,0,0,1,0,0,0,0,0,1,1,1,1,1
SHISEIDO-Future Solution LX Total Regenerating Cream,3.7,1,1,1,1,0,1,0,0,0,0,1,0,1,0,0,0,0,0,0,0,1,0,0,0,0,0,1,1,1,1,1
SHISEIDO-Future Solution LX Universal Defense,3.0,1,1,1,1,0,0,0,0,0,0,1,0,0,0,0,0,1,0,0,0,1,0,0,0,0,0,1,1,1,1,1
SULWHASOO-Essential Comfort Balancing Emulsion Moisturiser,4.3,1,1,1,1,0,0,0,0,0,1,0,0,0,0,0,0,1,0,0,0,1,0,0,1,0,0,1,1,1,1,1
LAB SERIES-Anti-Age Max LS Cream,4.3,1,1,1,1,0,1,0,0,0,1,1,1,1,0,0,0,0,0,0,0,1,0,0,0,0,0,1,1,1,1,1
PHILOSOPHY-Hope In A Jar Hyaluronic Glow Moisturiser Water Cream,5.0,1,1,1,1,0,0,0,0,0,1,1,0,0,0,0,0,1,0,0,0,1,0,0,0,0,0,1,1,1,1,1
"LANCÔME-Rénergie Multi-Lift Memory Shape™ Gel-in-Lotion, 200ml",4.6,1,1,1,1,1,1,0,0,0,1,1,1,1,0,0,0,0,1,0,0,0,1,0,0,0,0,1,1,1,1,1
ORIGINS-Dr. Andrew Weil for Origins™ Relief & Resilience Soothing Cream,4.3,1,1,1,1,1,0,0,0,0,1,1,0,0,0,0,0,0,0,0,0,1,0,0,0,0,0,1,1,1,1,1
DERMALOGICA CLEAR START-Skin Soothing Hydrating Lotion,4.1,1,1,1,1,0,0,0,1,0,1,0,0,0,0,0,0,0,0,0,0,1,0,0,1,0,0,1,1,1,1,1
THE INKEY LIST-Selfless by Hyram Niacinamide and Maracuja Daily Barrier Support Moisturizer,3.9,1,1,1,1,0,0,0,0,0,1,0,0,0,1,0,0,1,1,1,0,1,1,0,0,0,0,1,1,1,1,1
LANEIGE-Water Bank Blue Hyaluronic Cream - For Combination To Oily Skin,4.6,1,1,1,1,1,0,0,0,0,1,0,0,0,0,0,0,0,0,0,0,1,1,0,0,0,0,1,1,1,1,1
LANCÔME-Rénergie Multi-Lift Ultra Cream,5.0,1,1,1,1,0,0,0,0,0,0,1,1,1,0,1,0,0,1,0,0,1,0,0,0,0,0,1,1,1,1,1
EVEREDEN-Soothing Baby Massage Oil,4.8,1,1,1,1,1,0,0,0,0,1,0,0,0,0,0,0,1,0,0,0,0,0,0,0,1,0,1,1,1,1,1
DR.JART+-Cicapair Calming Gel Cream,4.6,1,1,1,1,1,0,0,0,0,1,1,0,0,0,0,0,1,0,0,0,1,1,0,0,0,0,1,1,1,1,1
LA MER-The Moisturising Cool Gel Cream Moisturizer,3.8,1,0,0,1,0,0,0,0,0,1,1,0,0,0,0,0,0,0,0,0,0,1,0,0,0,0,1,1,1,1,1
LA MER-The Deep Soothing Collection (Christmas Limited Edition),4.3,1,1,1,1,1,0,0,0,0,1,0,0,0,0,0,0,1,0,0,0,1,0,0,0,0,0,1,1,1,1,1
ELEMIS-Superfood Glow Priming Moisturiser,4.3,1,1,1,1,0,0,0,0,0,1,1,0,0,0,0,0,0,0,0,0,1,0,0,0,0,0,1,1,1,1,1
DERMALOGICA-Barrier Repair Moisturizer,4.6,1,1,1,1,0,0,0,1,0,0,0,0,0,0,0,0,0,0,0,0,1,0,0,0,0,0,1,1,1,1,1
DR.JART+-Ctrl-A Teatreement™ Moisturizer,4.6,1,0,0,1,0,0,0,1,0,1,1,0,0,1,0,0,1,0,1,0,1,0,0,0,0,0,1,1,1,1,1
CLINIQUE-Dramatically Different Moisturizing Lotion+,4.4,1,0,1,0,1,0,0,0,0,1,0,0,0,0,0,0,0,0,0,0,0,0,0,1,0,0,1,1,1,1,1
PETER THOMAS ROTH-Water Drench Hyaluronic Cloud Cream Hydrating Moisturizer,4.3,1,1,1,1,0,1,0,0,0,1,0,1,0,0,0,1,0,0,0,0,1,0,0,0,0,0,0,1,1,1,0
LANEIGE-Radian-C Cream,4.3,1,1,1,1,1,1,0,0,0,1,1,0,0,0,1,0,1,1,0,0,1,0,0,0,0,0,1,1,1,1,0
ESTÉE LAUDER-Micro Essence Skin Activating Treatment Lotion Fresh with Sakura Ferment,4.4,1,1,1,1,0,0,0,0,0,1,1,0,0,0,0,0,1,0,1,0,0,0,0,1,0,0,1,1,1,1,1
DR.JART+-V7 Toning Light Quatro Lunar New Year (Limited Edition),4.3,1,1,1,1,0,0,0,0,0,1,1,0,0,0,0,0,0,1,0,0,1,0,0,0,0,0,1,1,1,1,1
SHISEIDO-Vital Perfection Uplifting & Firming Cream Enriched,5.0,1,1,1,1,0,1,0,0,0,1,0,1,1,0,1,0,0,0,0,0,1,0,0,0,0,0,1,1,1,1,0
PHILOSOPHY-Purity Made Simple Ultra-Light Moisturizer,4.3,1,1,1,1,1,1,0,0,0,1,0,0,0,0,0,0,0,0,1,0,1,0,0,0,0,0,1,1,1,1,0
SHISEIDO-Vital Perfection Uplifting & Firming Cream,4.4,1,1,1,1,0,1,0,0,0,1,0,1,1,0,1,0,0,0,0,0,1,0,0,0,0,0,1,1,1,1,0
KENZOKI-Youth Flow Skin Renew Velvet Cream,5.0,1,1,1,1,0,1,0,0,0,1,1,1,1,0,0,0,0,0,0,0,1,0,0,0,0,0,1,1,1,1,1
FRESH-Rose Hydrating Water Gel Cream Moisturizer,4.2,1,1,1,1,0,0,0,0,0,1,0,0,0,0,0,0,0,0,0,0,1,1,0,0,0,0,1,1,1,1,1
FRESH-Vitamin Nectar Moisture Glow Face Cream,4.3,1,1,1,1,0,0,0,0,0,0,1,0,0,0,0,0,0,0,0,0,1,0,0,0,0,0,1,1,1,0,0
THIS WORKS-In Transit Skin Defence SPF30,4.1,1,1,1,1,1,1,0,1,0,1,0,0,0,0,0,0,1,0,0,0,1,0,0,0,0,0,1,1,1,1,1
DRGL-Moisturiser Collagen Boost,4.3,1,1,1,1,0,0,0,0,0,1,0,1,0,0,0,0,0,0,0,0,1,0,0,0,0,0,1,1,1,1,0
DRGL-Moisturiser All Skin Types,4.0,1,1,1,1,1,1,0,0,0,1,1,1,1,0,1,0,0,0,0,0,0,0,1,0,0,0,0,1,1,1,0
DOERS OF LONDON-Hydrating Face Cream,4.3,1,1,1,1,1,1,0,0,0,1,0,0,0,1,0,0,0,0,0,0,1,0,0,0,0,0,1,1,1,1,1
SHISEIDO-Future Solution LX Legendary Enmei Ultimate Renewing Cream,4.3,1,1,1,1,1,1,0,0,0,1,1,0,1,0,0,0,1,0,0,0,1,0,0,0,0,0,1,1,1,1,1
SHISEIDO-Future Solution LX Total Protective Cream,4.3,1,1,1,1,0,1,0,0,0,1,1,1,0,0,0,0,1,0,1,0,1,0,0,0,0,0,1,1,1,1,1
CLINIQUE-Clinique For Men™ Maximum Hydrator Eye 96-Hour Hydro-Filler Concentrate,5.0,1,1,1,1,1,0,0,0,0,1,1,0,0,0,0,0,1,1,0,0,0,1,0,0,0,0,1,1,1,1,1
THREE-Balancing Emulsion R,5.0,1,1,1,0,0,0,0,0,0,1,0,0,0,0,0,0,0,0,0,0,0,0,1,0,0,0,1,1,1,1,1
CLINIQUE-Dramatically Different Hydrating Jelly,4.3,1,1,1,1,1,0,0,0,0,1,0,0,0,0,0,0,1,0,0,0,0,1,0,0,0,0,1,1,1,1,1
GIVENCHY-Skin Ressource Protective Moisturising Velvet Cream Refill,4.3,1,1,1,1,0,0,0,0,0,1,1,0,0,0,0,0,0,0,0,0,1,1,0,0,0,0,1,1,1,1,1
PETER THOMAS ROTH-Pro Strength Niacinamide Discoloration Treatment,4.2,1,1,1,1,0,1,0,1,0,0,0,0,0,0,1,0,0,1,0,0,1,0,0,0,0,0,1,1,1,1,1
SHISEIDO-Waso Quick Matte Moisturizer Oil-free,4.3,1,0,0,1,0,0,0,0,0,0,1,0,0,1,0,0,0,0,0,0,0,0,1,0,0,0,1,1,1,1,1
CLINIQUE-Clinique For Men Moisturizing Lotion,4.0,0,1,1,0,0,0,0,0,0,1,0,0,0,0,0,0,0,0,0,0,1,0,0,0,0,0,1,1,1,1,1
DIOR-Capture Youth Age-Delay Advanced Crème Moisturiser,4.3,1,1,1,1,0,1,0,0,0,0,0,1,0,0,0,0,1,0,0,0,1,0,0,0,0,0,0,1,1,1,0
SHISEIDO-Men Total Revitalizer Light Fluid Lotion,4.3,1,1,1,1,0,1,0,0,0,1,1,1,1,0,0,0,1,1,0,0,0,0,0,1,0,0,1,1,1,1,1
ELEMIS-Superfood Day Cream,4.3,1,1,1,1,0,0,0,0,0,1,1,0,0,0,0,0,0,0,0,0,1,0,0,0,0,0,1,1,1,1,1
DIOR-Prestige La Crème Texture Essentielle,4.3,1,1,1,1,0,1,0,0,0,0,0,1,0,0,0,0,1,0,0,0,1,0,0,0,0,0,1,1,1,1,1
LAB SERIES-Daily Rescue Energizing Face Lotion,4.3,1,1,1,1,0,1,0,0,0,1,1,1,0,0,0,0,1,0,0,0,0,0,0,1,0,0,1,1,1,1,1
SHISEIDO-Essential Energy Hydrating Day Cream,4.3,1,1,1,1,1,0,0,0,0,1,1,0,0,0,0,0,1,0,0,0,1,0,0,0,0,0,1,1,1,1,1
DR.JART+-V7 Toning Light,4.3,1,1,1,1,0,0,0,0,0,1,1,0,0,0,0,0,1,1,0,0,1,0,0,0,0,0,1,1,1,1,1
DR.JART+-V7 Toning Light,4.3,1,1,1,1,0,0,0,0,0,1,1,0,0,0,0,0,1,1,0,0,1,0,0,0,0,0,1,1,1,1,1
SHISEIDO-Treatment Softener Lotion,5.0,1,0,1,1,0,0,0,0,0,1,0,1,0,0,0,0,1,0,0,0,0,0,0,1,0,0,1,1,1,1,0
SULWHASOO-Concentrated Ginseng Renewing Cream EX Classic,5.0,1,1,1,1,0,1,0,0,0,1,1,0,1,0,0,0,1,0,0,0,1,0,0,0,0,0,1,1,1,1,1
SAND & SKY-Tasmanian Spring Water Hydration Boost Cream,4.0,1,1,1,1,0,1,0,0,0,1,0,1,0,0,0,0,1,0,0,0,1,0,0,0,0,0,1,1,1,1,1
JUICE BEAUTY-Stem Cellular™ Anti-Wrinkle Moisturizer,4.3,1,1,1,1,0,0,0,0,0,1,0,1,0,0,0,0,0,1,0,0,1,0,0,0,0,0,0,1,1,1,1
ORIGINS-Love And Be: Youthful Plantscription™ Youth-Boosting Regimen Trio,4.3,1,1,1,1,0,1,0,0,0,1,0,1,1,0,0,0,1,0,1,0,1,0,1,0,0,0,1,1,1,1,1
INNISFREE-Bija Cica Balm,4.3,1,0,1,1,0,0,0,0,0,1,0,0,0,0,0,0,1,0,0,0,1,0,0,0,0,0,1,1,1,1,1
SK-II-SK-II Mid-Day Miracle Essence,4.2,1,1,1,1,0,0,0,0,0,1,1,0,0,0,0,0,0,0,0,0,0,0,0,0,0,1,1,1,1,1,1
PETER THOMAS ROTH-Potent-C Power Eye Cream,4.1,1,1,1,1,1,1,0,0,1,0,0,1,0,0,0,0,0,0,0,0,1,0,0,0,0,0,1,1,1,1,0
GLO SKIN BEAUTY-Hydra-Bright AHA Hydrator,4.3,1,1,1,1,0,0,0,0,0,1,1,0,0,0,0,0,1,0,0,0,1,0,0,0,0,0,1,1,1,1,1
EVEREDEN-Nourishing Baby Face Cream,4.8,1,1,1,1,1,0,0,0,0,1,0,0,0,0,0,0,1,0,0,0,1,0,0,0,0,0,1,1,1,1,1
LAB SERIES-All-In-One Face Treatment,5.0,1,1,1,1,0,0,0,0,0,1,1,1,0,1,0,0,0,0,0,0,1,0,0,0,0,0,1,1,1,1,1
SATURDAY SKIN-Waterfall Glacier Water Cream,4.4,1,1,1,1,1,0,0,0,0,1,1,0,1,0,0,0,1,1,0,0,0,1,0,0,0,0,1,1,1,1,1
GIVENCHY-Ressource Soothing Moisturizing Treatment Lotion,4.3,1,1,1,1,1,0,0,0,0,1,0,0,0,0,0,0,1,0,0,0,0,0,0,1,0,0,1,1,1,1,1
MARIO BADESCU-Oil Free Moisturizer,3.9,1,1,1,1,1,1,0,0,0,0,1,0,0,1,0,0,0,1,0,0,0,0,0,1,0,0,1,1,0,0,1
KORA ORGANICS BY MIRANDA KERR-Active Algae Lightweight Moisturizer,4.7,1,1,1,1,0,0,0,0,0,1,1,1,1,0,0,0,1,1,1,0,0,1,0,0,0,0,1,1,1,1,1
ALLIES OF SKIN-Molecular Barrier Recovery Cream Balm,4.3,1,1,1,1,0,0,0,0,0,1,0,1,1,0,0,0,1,0,0,1,1,0,0,0,0,0,1,1,1,1,1
TALIKA-Skintelligence Hydra - Intense Hydrating Rich Cream,4.3,1,1,1,1,0,0,0,0,0,1,1,0,0,0,0,0,0,0,0,0,1,0,0,0,0,0,1,1,1,1,1
CAUDALIE-Vinopure Skin Perfecting Mattifying Moisturizer,3.9,1,1,1,1,1,0,1,1,0,1,1,0,0,0,0,0,0,1,0,0,0,0,0,1,0,0,1,1,1,1,1
ALPHA-H-Protection Plus Daily Moisturiser SPF 50+ with Pomegranate Seed Oil,4.2,1,1,1,1,1,0,0,0,0,1,0,1,0,0,1,0,0,0,0,0,1,0,0,0,0,0,1,1,1,1,1
ALLIES OF SKIN-Peptides & Antioxidants Firming Daily Treatment,4.9,1,1,1,1,0,0,0,0,0,1,1,1,1,0,0,0,0,0,1,0,1,0,0,0,0,0,1,1,1,1,0
STARSKIN-Orglamic™ Pink Cactus Pudding Moisturiser,4.4,1,1,1,1,1,0,0,0,0,1,1,0,0,0,0,0,1,1,0,0,1,1,0,1,0,0,1,1,1,1,1
PIXI-Skintreats Clarity Lotion Oil-Free Moisturiser,4.0,1,1,1,1,0,0,0,1,0,1,1,0,0,1,0,0,0,0,1,0,0,0,0,1,0,0,1,1,1,1,1
BOSCIA-Plant Stem Cell And Ceramide Barrier-Defense Moisturizer,4.3,1,1,1,1,0,1,0,0,0,1,0,1,1,0,0,0,0,0,0,0,1,0,0,0,0,0,1,1,1,1,1
PAI SKINCARE-Love & Haight Avocado & Jojoba Hydrating Moisturizer,5.0,1,1,1,1,0,0,0,0,0,1,1,1,0,0,0,0,0,0,0,0,1,0,0,0,0,0,1,1,1,1,1
PAI SKINCARE-The Anthemis Chamomile & Rosehip Soothing Moisturizer,4.3,1,1,1,1,0,0,0,0,0,1,0,0,0,0,0,0,0,0,0,0,1,0,0,0,0,0,1,1,1,1,1
PIXI-Rose Ceramide Cream,4.1,1,1,1,1,1,0,0,0,0,1,0,0,0,0,0,0,1,0,0,0,1,0,0,0,0,0,1,1,1,1,1
CAUDALIE-Vinoperfect Instant Brightening Moisturizer,4.0,1,1,1,1,0,1,0,1,0,1,1,0,0,0,1,0,0,1,0,0,1,1,0,0,0,0,1,1,1,1,1
ALLIES OF SKIN-CE15 Bakuchiol Firming Oil,4.3,1,1,1,1,0,1,0,0,0,1,1,0,1,0,1,0,0,0,0,0,0,0,0,0,1,0,1,1,1,1,1
PIXI-Phenomenal Gel,4.1,1,1,1,0,0,0,0,1,0,0,1,0,0,0,0,0,0,0,0,0,0,1,0,0,0,0,1,1,1,1,1
PIXI-Vitamin-C Lotion,4.4,1,1,1,1,0,0,0,0,0,0,1,0,0,0,1,0,0,1,0,0,0,0,0,1,0,0,1,1,1,1,0
SUNDAY RILEY-Ice Ceramide Moisturizing Cream,4.1,0,1,1,0,1,1,0,0,0,1,0,0,0,0,0,0,0,0,0,0,1,0,0,0,0,0,1,1,1,1,1
MARIO BADESCU-Peptide Renewal Cream,3.9,1,1,0,0,1,0,0,0,0,1,0,0,1,0,0,0,0,0,0,0,1,0,0,0,0,0,0,1,1,1,0
PIXI-Rose Caviar Essence,4.1,1,1,1,1,0,0,0,0,0,1,1,0,0,0,0,0,0,0,0,0,0,0,1,0,0,0,1,1,1,1,0
CLINIQUE-Smart Clinical Repair Wrinkle Correcting Cream,4.2,1,1,1,1,0,1,0,0,0,1,0,1,0,0,0,0,1,0,0,0,1,0,0,0,0,0,1,1,1,1,1
PETER THOMAS ROTH-Vital-E Microbiome Age Defense Cream,4.4,1,1,1,1,0,1,0,0,0,0,1,0,0,0,0,0,0,0,0,0,1,0,0,0,0,0,1,1,1,1,1
DIOR-Hydra Life Sorbet Crème,4.0,1,1,1,1,0,0,0,0,0,1,0,0,0,0,0,0,1,0,0,0,1,1,0,0,0,0,1,1,1,1,1
DERMALOGICA-Calm Water Gel,4.4,0,0,0,0,1,0,0,0,0,1,0,0,0,0,0,0,0,0,0,0,0,1,0,0,0,0,1,1,1,1,1
DERMALOGICA-Skin Smoothing Moisturizer Cream,4.6,1,1,1,1,0,0,0,0,0,1,0,0,0,0,0,0,0,0,0,0,1,0,0,0,0,0,1,1,1,1,1
DERMALOGICA-Intensive Moisture Balance Moisturizer,4.5,1,1,1,1,0,0,0,0,0,1,0,1,0,0,0,0,0,0,0,0,1,0,0,0,0,0,1,1,1,1,1
DERMALOGICA-Active Moist 2.0 Moisturizer,4.6,1,1,1,1,0,0,0,0,0,1,0,0,0,0,0,0,1,0,0,0,0,0,0,1,0,0,1,1,1,1,1
MALIN + GOETZ-Advanced Renewal Cream,4.3,1,1,1,1,1,1,0,0,0,1,1,1,1,0,0,0,0,0,0,0,1,0,0,0,0,0,1,1,1,1,1
GUERLAIN-Abeille Royale Mattifying Day Cream,1.0,1,0,1,1,0,0,0,0,0,1,1,1,1,0,0,0,1,1,1,0,1,0,0,0,0,0,1,1,1,1,1
LAB SERIES-Daily Rescue Energizing Gel Cream,5.0,1,1,1,1,0,1,0,0,0,1,1,1,0,0,0,0,0,0,0,0,1,1,0,0,0,0,1,1,1,1,1
THIS WORKS-In Transit Camera Close-up,4.1,1,1,1,1,1,1,0,0,0,1,1,1,1,0,0,0,0,1,0,0,1,0,0,0,0,0,1,1,1,1,0
BUTTER LONDON-Extra Whip Hand & Foot Treatment,4.3,1,1,1,1,0,1,0,0,0,1,1,1,1,0,0,0,1,0,0,0,1,0,0,0,0,0,1,1,1,1,1
GIVENCHY-Skin Ressource Soothing Moisturising Lotion,4.3,1,1,1,1,0,0,0,0,0,1,0,0,0,0,0,0,1,0,0,0,0,0,0,1,0,0,1,1,1,1,1
SHISEIDO-Vital Perfection Uplifting And Firming Day Emulsion,5.0,1,1,1,1,0,1,0,0,0,1,0,1,1,0,0,0,0,0,0,0,1,0,0,0,0,0,1,1,1,1,1
PETER THOMAS ROTH-Potent-C Bright & Plump Moisturizer,3.7,1,1,1,1,1,1,0,1,0,1,1,1,1,0,0,0,0,0,0,0,1,0,0,0,0,0,1,1,1,1,1
LIXIRSKIN-Universal Emulsion,4.3,1,1,1,1,1,0,0,0,0,1,1,1,0,0,0,0,0,0,0,0,1,0,0,0,0,0,1,1,1,1,0
GIVENCHY-Skin Perfecto Radiance Reviver Emulsion,4.3,1,1,1,1,0,0,0,0,0,1,1,0,0,0,0,0,1,0,0,0,0,0,1,0,0,0,1,1,1,1,1
INDIE LEE-Daily Skin Nutrition Moisturizer,4.0,1,1,1,1,0,0,0,0,0,1,1,1,0,0,0,0,1,1,0,0,0,0,0,1,0,0,1,1,1,1,1
SHISEIDO-Future Solution LX Total Protective Emulsion,5.0,1,1,1,1,0,1,0,0,0,1,1,1,0,0,0,0,1,0,1,0,1,0,0,1,0,0,1,1,1,1,1
SULWHASOO-Concentrated Ginseng Renewing Emulsion EX,4.3,1,1,1,1,0,1,0,0,0,1,0,0,1,0,0,0,0,0,0,0,0,0,0,1,0,0,1,1,1,1,1
ELEMIS-Pro-Collagen Marine Cream,4.3,1,1,1,1,0,1,0,0,0,1,0,1,1,0,0,0,1,0,0,0,1,0,0,0,0,0,1,1,1,1,1
LANEIGE-Water Bank Blue Hyaluronic Emulsion - For Combination To Oily Skin,5.0,1,1,1,1,0,0,0,0,0,1,0,0,0,0,0,0,0,0,0,0,0,0,0,1,0,0,1,1,1,1,1
DIOR-Diorsnow Essence Of Light Lock & Reflect Creme,4.3,1,1,1,1,0,0,0,0,0,1,1,0,0,0,0,0,0,0,0,0,1,0,0,0,0,0,1,1,1,1,1
NON GENDER SPECIFIC-Everything Cream,4.3,1,1,1,1,0,0,0,0,0,1,1,0,0,0,0,0,0,0,1,0,1,0,0,0,0,0,1,1,1,1,1
SULWHASOO-Concentrated Ginseng Renewing Cream EX,4.3,1,1,1,1,0,1,0,0,0,1,1,0,1,0,0,0,1,0,0,0,1,0,0,0,0,0,1,1,1,1,1
FRANK BODY-Everyday Face Moisturiser,3.6,0,0,1,1,0,0,1,0,0,1,1,0,0,1,0,0,0,0,0,0,1,0,0,0,0,0,1,1,1,1,1
CLE DE PEAU-Volumizing Cream Supreme,4.3,1,1,1,1,0,1,0,0,0,0,1,1,0,0,0,0,0,0,0,0,1,0,0,0,0,0,1,1,1,1,1
GIVENCHY-Ressource Rich Moisturizing Face Cream,3.0,1,1,1,1,1,0,0,0,0,1,1,0,0,0,0,0,0,0,0,0,1,0,0,0,0,0,1,1,1,1,1
MALIN + GOETZ-Advanced Renewal Moisturizer,4.5,1,1,1,1,1,0,0,0,0,1,0,1,0,0,0,0,1,0,0,0,1,0,0,0,0,0,1,1,1,1,1
SHISEIDO-Ultimune Future Power Shot (Limited Edition),4.3,1,1,1,1,0,0,0,0,0,1,0,0,0,0,0,0,0,0,0,0,1,0,0,0,0,0,1,1,1,1,1
THE INKEY LIST-Multi-Biotic Moisturiser,3.6,1,1,1,1,1,0,0,0,0,1,0,0,0,0,0,0,0,0,0,0,1,0,0,0,0,0,1,1,1,1,0
